RS Omni Internasional,"Jl. Alam Sutera Boulevard Kav.25,Tangerang",A,,Tangerang,Banten,-6.244600000000000,106.651022000000000,rs
RS Aminah,"Jl. Hos Cokroaminoto No.4 A, Kreo Selatan",A,,Tangerang,Banten,-6.238039000000000,106.745000000000000,rs
RSK Bedah Benggala,"Jl. Yusuf Martadilaga No.56,Serang",K,,Serang,Banten,-6.121222000000000,106.154875000000000,rs
RS DIM 0506 Tangerang,Jl. Daan Mogot 59 Tangerang,A,4,Kota Tangerang,Banten,-6.163469000000000,106.659133000000000,rs
RS Siloam Gleneagles,Jl. Siloam Lippo Karawaci Tangerang,A,,Kota Tangerang,Banten,-6.225247000000000,106.597422000000000,rs
RS Internasional Bintaro,"Jl. MH Thamrin No.1 Sektor 7 Bintaro Jaya,Tangerang",A,,Kota Tangerang,Banten,-6.276139000000000,106.723664000000000,rs
RS Eka,"Jl. Raya Serpong Km.8,Kab.Tangerang",A,,Kota Tangerang,Banten,-6.298989000000000,106.669936000000000,rs
RSU Mulya,"Jl. Jl.K.H. Hasyim Ashari No.18,Tangerang",A,,Kota Tangerang,Banten,-6.222022000000000,106.687614000000000,rs
RS Bhakti Asih,"Jl. Raden saleh No.10 Karang Tengah, Tangerang",A,,Kota Tangerang,Banten,-6.221147000000000,106.705767000000000,rs
RS Krakatau Medika,Jl. Semang Raya Cilegon,A,B,Cilegon,Banten,-5.990553000000000,106.033192000000000,rs
RS Hermina Tangerang,"Jl. KS, Tubun No.10 Kel. Pasar Baru Kec. Karawaci Kota Tangerang",A,0,,Banten,-6.203764000000000,106.630217000000000,rs
RSU Rafflesia,"Jl. Mahoni No.10 Sawah Lebar,Bengkulu",A,D,Kota Bengkulu,Bengkulu,-3.800650000000000,102.256203000000000,rs
RSU Curup,Jl. Basuki Rachmad No.10 Curup,A,C,Rejang Lebong,Bengkulu,-3.457453000000000,102.553264000000000,rs
RS Bergerak Enggano,Jl. Raya Malakoni KM3 Enggano,A,D,Bengkulu Utara,Bengkulu,-2.666489000000000,101.344353000000000,rs
RSJKO Soeprapto Bengkulu,Jl. Bhakti Husada Lingkar Barat Bengkulu,B,B,Kota Bengkulu,Bengkulu,-3.800650000000000,102.256203000000000,rs
Rumkit Tk IV Bengkulu,"Jl. Zainal Arifin Gading Cempaka,Bengkulu",A,D,Kota Bengkulu,Bengkulu,-3.800650000000000,102.256203000000000,rs
RSU Arga Makmur,Jl. Siti Khadijah Arga Makmur,A,C,Bengkulu Utara,Bengkulu,-2.666489000000000,101.344353000000000,rs
RSUD Mukomuko,"Jl. Padat Karya No.166,Mukomuko",A,D,Muko-Muko,Bengkulu,-2.575764000000000,101.117303000000000,rs
Rumkit Bhayangkara Jitra Bengkulu,Jl. Veteran No. Bengkulu,A,4,Kota Bengkulu,Bengkulu,-3.792364000000000,102.254283000000000,rs
RSUD Bengkulu Tengah,"Jl. Raya Bengkulu - Kepahyang Km.34,5 Ds. Bajak I",A,D,Bengkulu Tengah,Bengkulu,-3.800650000000000,102.256203000000000,rs
RS Hana Charitas Arga Makmur,"Jl. IR. Sukarno No.12 Arga Makmur, Bengkulu Utara",A,D,Bengkulu Utara,Bengkulu,-2.666489000000000,101.344353000000000,rs
RSU Manna,"Jl. Fatmawati Soekarno 31,Manna",A,C,Bengkulu Selatan,Bengkulu,-3.800650000000000,102.256203000000000,rs
RSUD Tais Kab.Seluma,"Jl. Raya Bengkulu - Manna KM.64,Tais",A,D,Seluma,Bengkulu,-4.049086000000000,102.527925000000000,rs
RSUD Muaradua,Jl. Raya Ranau Desa Suka Jaya Kec.Muaradua,A,D,Ogan Komering Ulu Selatan,Sumatera Selatan,-4.797092000000000,103.383611000000000,rs
RSUD Kepahiang,"Jl. Kolonel Santoso No.325,Kab.Kepahiang",A,D,Kepahiang,Bengkulu,-3.643758000000000,102.573986000000000,rs
RSU Dr M Yunus Bengkulu,"Jl. Bayangkara S.Mulyo,Bengkulu",A,B,Bengkulu,Bengkulu,-3.833831000000000,102.313431000000000,rs
RS St Elizabeth Bantul,Ganjuran Kab Bantul Yogyakarta,A,,Bantul,DI Yogyakarta,-7.885550000000000,110.330022000000000,rs
RSU Panti Baktiningsih,"Klepu Sendangmulyo Minggir,Sleman",A,,Sleman,DI Yogyakarta,-7.756089000000000,110.245000000000000,rs
RSU Panti Rapih,Jl. Cik Ditiro 30 Yogyakarta,A,B,Kota Yogyakarta,DI Yogyakarta,-7.776339000000000,110.376000000000000,rs
RS St Yusup Boro,Boro Banjarasri Kulon Progo,A,,Kulon Progo,DI Yogyakarta,-7.826681000000000,110.164086000000000,rs
RSUP Dr. Sarjito,Jl. Kesehatan Sekip Yogyakarta,A,A,Sleman,DI Yogyakarta,-7.768511000000000,110.374000000000000,rs
RSU Permata Husada,jl.pleret-kotagede km-4,RSU,D,Bantul,DI Yogyakarta,-7.885550000000000,110.330022000000000,rs
RSUD Wates,Jl. Tentara Pelajar No. 1 Wates,A,C,Kulon Progo,DI Yogyakarta,-7.893206000000000,110.127822000000000,rs
RS Islam Yogyakarta PDHI,"Jl. Solo Km 12,5 Kalasan Yogya",A,D,Sleman,DI Yogyakarta,-7.776886000000000,110.457056000000000,rs
RSU Kharisma Paramedika,"Jl. Khudori No.34, Wates, Kulon Progo",A,,DI Yogyakarta,DI Yogyakarta,-7.893206000000000,110.127822000000000,rs
RSU Rachma Husada,Jl. Parantritis Km.16 Gerselo Patalan Jetis Bantul,A,,DI Yogyakarta,DI Yogyakarta,-7.909600000000000,110.352264000000000,rs
RSU Rajawali Citra,"Jl. Pleret Km.2,5, Banjardadap Potorono Banguntapan Bantul",A,,DI Yogyakarta,DI Yogyakarta,-7.885550000000000,110.330022000000000,rs
RSU Queen Latifa,Jl. Ring Road Barat - Mlangi - Nogotirto - Sleman,A,,DI Yogyakarta,DI Yogyakarta,-7.696006000000000,110.345825000000000,rs
RS Condong Catur,"Jl. Manggis No.6, Gempol, Condong Catur Sleman",A,,DI Yogyakarta,DI Yogyakarta,-7.696006000000000,110.345825000000000,rs
RS Puri Husada Yogyakarta,Jl. Palagan Tentara Pelajar No.67 Km.11 Rejodani Ngaglik Sleman,A,,DI Yogyakarta,DI Yogyakarta,-7.705728000000000,110.386306000000000,rs
RSUD Prambanan,Jl. Prambanan Piyungan Km.6 Sumber Harjo Prambanan Sleman,A,D,DI Yogyakarta,DI Yogyakarta,-7.814464000000000,110.482036000000000,rs
RS PKU Muhammadiyah,"Jl. Ronggowarsito 130,Surakarta",A,C,Surakarta,Jawa Tengah,-7.800600000000000,110.362000000000000,rs
RSKB Rizki Amalia Medika,Jl. Brosot - Wates Km.5 Jogahan Bumirejo Lendah Kulon Progo,A,,Kulon Progo,DI Yogyakarta,-7.912131000000000,110.202939000000000,rs
RSUD Penembahan Senopati,Jl. Dr. Wahidin SH Bantul,A,B,Bantul,DI Yogyakarta,-7.892725000000000,110.337742000000000,rs
RS PKU Muhammadiyah Bantul,Jl. Jenderal Sudirman 124 Bantul,O,C,Bantul,DI Yogyakarta,-7.886867000000000,110.330214000000000,rs
RSIA Ummi Khasanah,Jl. Pemuda Ds Gandekan Bantul,O,,Bantul,DI Yogyakarta,-7.878825000000000,110.331269000000000,rs
RS Khusus Bedah Nur Hidayah,"Jl. Imogiri Timur Km. 11,5 Trimulyo Jetis Bantul",K,,Bantul,DI Yogyakarta,-7.891339000000000,110.385794000000000,rs
RSUD Wonosari,Jl. Taman Bakti Wonosari,A,C,Gunung Kidul,DI Yogyakarta,-7.962050000000000,110.603000000000000,rs
RS Nur Rohmah,"Ds.Jamburejo,Ds.Bandung,Kec.Playen,Kab.Gunungkidul",A,,Gunung Kidul,DI Yogyakarta,-7.938303000000000,110.575753000000000,rs
RSUD Sleman,Jl. Bhayangkara 48 Sleman,A,B,Sleman,DI Yogyakarta,-7.687569000000000,110.342000000000000,rs
RS Jiwa Ghrasia/Lalijiwa pakem,Jl. Kaliurang No. 17 Yogyakarta,B,A,Sleman,DI Yogyakarta,-7.688728000000000,110.418733000000000,rs
RSK Bedah An-Nur,"Jl. Samirono Baru No.14-16,Sleman",K,,Sleman,DI Yogyakarta,-7.777183000000000,110.384367000000000,rs
RS Panti Rini,"Jl. Solo Km 13,2, Sleman",A,,Sleman,DI Yogyakarta,-7.771761000000000,110.467000000000000,rs
RS Lokapala,Jl. Pemuda 1 Sleman Yogyakarta,A,,Sleman,DI Yogyakarta,-7.778044000000000,110.415519000000000,rs
RS Panti Nugroho,"Jl. Kaliurang Km.17 Pakem,Sleman",A,,Sleman,DI Yogyakarta,-7.669028000000000,110.417492000000000,rs
RSK Bedah Dharma Husada,Jl. Yogya-Wonosari Sleman Yogya,K,,Sleman,DI Yogyakarta,-7.855453000000000,110.497022000000000,rs
RS Ibu dan Anak Sakina Idaman,"Jl. Nyi Condrolukito,Blunyah Gede 60,Sleman",O,C,Sleman,DI Yogyakarta,-7.769550000000000,110.368431000000000,rs
RS Islam Hidayatullah,"Jl. Veteran No.184, Yogyakarta",A,,Yogyakarta,DI Yogyakarta,-7.815406000000000,110.387797000000000,rs
Rumkit DKT Dr. Soetarto/Tk. III Yogyakarta,Jl. Juwadi 19 Yogyakarta,A,3,Yogyakarta,DI Yogyakarta,-7.785750000000000,110.376642000000000,rs
RS PKU Muhammadiyah Yogya,Jl. K.H. Ahmad Dahlan 20 Yogyakarta,A,C,Yogyakarta,DI Yogyakarta,-7.800600000000000,110.362000000000000,rs
RS Bethesda Yogyakarta,Jl. Jen Sudirman 70 Yogyakarta,A,B,Yogyakarta,DI Yogyakarta,-7.783611000000000,110.377000000000000,rs
RS Dr S Harjolukito,Lanud Adisucipto Yogyakarta,A,2,Yogyakarta,DI Yogyakarta,-7.790572000000000,110.410642000000000,rs
RS Jiwa Puri Nirmala,Jl. Jayaningprangan No.13 Yogyakarta,B,,Yogyakarta,DI Yogyakarta,-7.801044000000000,110.376825000000000,rs
RS Mata Dr. Yap,Jl. Cik Ditiro 7 Yogyakarta,D,,Yogyakarta,DI Yogyakarta,-7.780011000000000,110.375000000000000,rs
RSK Bedah Patmasuri,Lapangan Krapyak Yogyakarta,K,C,Yogyakarta,DI Yogyakarta,-7.828408000000000,110.360283000000000,rs
RSUD Kota Yogyakarta,Jl. Wirosaban No. 1 Yogyakarta,A,B,Yogyakarta,DI Yogyakarta,-7.825861000000000,110.378000000000000,rs
RSB Bhakti Ibu,Jl. Golo No.20 Yogyakarta,C,,Yogyakarta,DI Yogyakarta,-7.818278000000000,110.383983000000000,rs
RSK Bedah Soedirman,Jl. Sidobali UH II/402 Muja-Muju Yogyakarta,K,D,Yogyakarta,DI Yogyakarta,-7.797286000000000,110.394039000000000,rs
RSK P.Dalam Husada Tama,Jl. Wiratama 4 Yogyakarta,J,,Yogyakarta,DI Yogyakarta,-7.792467000000000,110.353075000000000,rs
RSK THT Sari Asih,Jl. Tirtodipuran No. 38 Yogya,M,,Yogyakarta,DI Yogyakarta,-7.788281000000000,110.372050000000000,rs
RSK Anak Empat Lima,Jl. Patangpuluhan No.35 Yogyakarta,P,,Yogyakarta,DI Yogyakarta,-7.807447000000000,110.347558000000000,rs
RSK THT Prof R Oepomo,Jl. Suryomentaraman 298 A Yogya,M,,Yogyakarta,DI Yogyakarta,-7.808250000000000,110.367128000000000,rs
RSIA Permata Bunda,Jl. Ngeksigondo 56 Yogyakarta,O,,Yogyakarta,DI Yogyakarta,-7.819036000000000,110.395708000000000,rs
RSGM Univ.Gajah Mada,Jl. Sekip Utara Yogyakarta,T,,Yogyakarta,DI Yogyakarta,-7.797117000000000,110.368669000000000,rs
RS Happy Land Medical Centre,"Jl. Ipda Tut Harsono No.53,Timoho Yogyakarta",A,,Yogyakarta,DI Yogyakarta,-7.790475000000000,110.393536000000000,rs
Rumah Sakit &quot;JIH&quot;,Jalan Ring Road Utara no. 160 Condongcatur Depok,A,B,Sleman,DI Yogyakarta,-7.759047000000000,110.403003000000000,rs
RSUD Otanaha Gorontalo,"Jl. Usman Isa, Gorontalo",A,D,Gorontalo,Gorontalo,0.552511000000000,123.065497000000000,rs
RS Islam Gorontalo,"Jl. KH. Agus Salim No.50, Gorontalo",A,,gorontalo,Gorontalo,0.565767000000000,123.047461000000000,rs
RSUD Tombulilato,Kabupaten Bine Bolango,A,D,Bone,Gorontalo,0.552536000000000,123.081511000000000,rs
RSUD Pohuwato,Jl. Teratai Desa Botubilotahu Gorontalo,A,D,Pohuwato,Gorontalo,0.517647000000000,121.732883000000000,rs
RSU Dr M Mohammad Dunda,Jl. A Yani Limboto Gorontalo,A,C,Boalemo,Gorontalo,0.701342000000000,122.265389000000000,rs
RS Kusta Toto,Toto Kec Kabila Kab Gorontalo,G,,Boalemo,Gorontalo,0.701342000000000,122.265389000000000,rs
RSUD Tani dan Nelayan,"Jl.Letjen Ahmad Yani Ds.Lamu Kec.Tilamuta,Kab.Boalemo",A,D,Boalemo,Gorontalo,0.701342000000000,122.265389000000000,rs
RSU Prof Dr H Aloei Saboe,Jl. Sultan Batutihe No. 7 Gorontalo,A,B,Gorontalo,Gorontalo,0.555200000000000,123.085769000000000,rs
RSU May.H.A. Thalib/Sungai Penuh,Jl. Basuki Rahmat,A,C,Kerinci,Jambi,-2.070419000000000,101.367831000000000,rs
RSUD Hamadjid Batoe BT Hari/ Muara Bulian,"Jl. Dr. Sri Sudewi,Muara Bulian",A,C,Batang Hari,Jambi,-1.890811000000000,102.997342000000000,rs
Rumkit Tk IV Dr. Bratanata Unang Jambi,"Jl. Raden Mattaher 33,Jambi",TNI AD,4,,Jambi,-1.591744000000000,103.618533000000000,rs
RSUD H. Hanafi/Muara Bungo,"Jl. Teuku Umar 88,Muaro Bungo",A,C,Bungo,Jambi,-1.509428000000000,101.960617000000000,rs
RS Budhi Graha,"Jl. Dr. Setia Budi 5,Jambi",A,D,,Jambi,-1.485183000000000,102.438058000000000,rs
RS Santa Theresia,"Jl. Dr. Sutomo No.19,Jambi",A,D,Jambi,Jambi,-1.485183000000000,102.438058000000000,rs
RS Asia Medika Jambi,"Jl. Soekarno - Hatta Palmerah,Jambi",A,,Jambi,Jambi,-1.485183000000000,102.438058000000000,rs
RSU KH. Daud Arif,"Jl. Syarif Hidayatullah,Kuala Tungkal",A,C,Tanjung Jabung Barat,Jambi,-1.132839000000000,103.062419000000000,rs
RSUD Sungai Bahar,Ds. Suka Makmur Kecamatan Sungai Bahar,A,D,jambi,Jambi,-1.858228000000000,103.550133000000000,rs
RS Mayang Medical Centre,"Jl. Ir.H. Juanda No.56 Simp III Sipin, Jambi",A,D,Jambi,Jambi,-1.630422000000000,103.550969000000000,rs
RS PTP VIII Kayu Aro,Kayu Aro Sei Penuh Kab.Kerinci,A,,Kerinci,Jambi,-1.912514000000000,101.305647000000000,rs
RSK Bedah Yayasan Bundo,"Jl. Pancasila 5, Sungai Penuh",K,,Kerinci,Jambi,-2.073025000000000,101.412375000000000,rs
RSUD Sultan Taha Saifudin,"Jl. Lintas Tebo-Bungo Km 4,Jambi",A,C,Tebo,Jambi,-1.484036000000000,102.276222000000000,rs
RSUD Kolonel Abundjani/Bangko,Lapangan Jambi Bajubang,A,C,Sarolangun Bangko,Jambi,-2.069014000000000,102.276275000000000,rs
RS Pertamina Bajubang,Lapangan Jambi Bajubang,A,,Sarolangun Bangko,Jambi,-1.587600000000000,103.618597000000000,rs
RSUD Prof.DR.H.M.Chatib Quzwain,"Jl. Lintas Sumatera Km.09 Desa Bukit,Sarolangun",A,C,Sarolangun Bangko,Jambi,-2.344406000000000,102.684717000000000,rs
RSUD Muaro Jambi,Jl. Lintas Timur,A,C,Muaro Jambi,Jambi,-1.703128000000000,103.821625000000000,rs
RSUD Nurdin Hamzah,"Jl. Keramas Muara,Sabak Barat",A,C,Tanjung Jabung Timur,Jambi,-1.136461000000000,104.007567000000000,rs
Rumkit Bhayangkara Jambi,"Jl. Raden Mathaher No.3,Jambi",A,4,Jambi,Jambi,-1.591744000000000,103.618533000000000,rs
RS Jiwa Jambi,"Jl. Dr. Purwadi Km.9,5,Jambi",B,B,Jambi,Jambi,-1.618597000000000,103.554150000000000,rs
RSUD H. Abdul Manap Kota Jambi,Jl. SK.Rd.Syahbuddin Kec.Kota Baru Jambi,A,D,Jambi,Jambi,-1.650011000000000,103.625472000000000,rs
RSU Raden Mattaher Jambi,"Jl. Letjen Suprapto 31,Jambi",A,B,,Jambi,-1.613925000000000,103.583714000000000,rs
Rumkit Tk II Dustira Cimahi,Jl. Rumah Sakit No.1 Cimahi,A,2,Bandung,Jawa Barat,-6.886111000000000,107.535567000000000,rs
RSUD Karawang,"Jl. Galuh Mas Raya No.1,Karawang",A,B,Karawang,Jawa Barat,-6.257053000000000,107.322856000000000,rs
RSU Santosa Bandung Internasional Hospital,"Jl. Kebon Jati No.38,Bandung",A,B,Kota Bandung,Jawa Barat,-6.918497000000000,107.598161000000000,rs
RS Bhakti Yudha,Jl. Raya Sawangan No. 2A Depok,A,C,Bogor,Jawa Barat,-6.397375000000000,106.806075000000000,rs
RS Mitra Keluarga Cibubur,"Jl. Alternatif Transyogi, Cibubur",A,C,Kota Bekasi,Jawa Barat,-6.383819000000000,106.933450000000000,rs
RS Puri Cinere,"Jl. Maribaya No.1 Puri Cinere,Depok",Swasta,B,Bogor,Jawa Barat,-6.321850000000000,106.782000000000000,rs
RSUD Kota Bandung/Ujung Berung,Jl. Rumah Sakit 22 Bandung,A,C,Kota Bandung,Jawa Barat,-6.915342000000000,107.698672000000000,rs
RS Harapan Depok,"Jl. Pemuda No.10,Depok Bogor",A,D,Bogor,Jawa Barat,-6.402731000000000,106.820000000000000,rs
RSU Meilia,"Jl. Alternatif Cibubur - Cilenungsi,Cimanggis, Depok",A,B,Bogor,Jawa Barat,-6.376261000000000,106.902000000000000,rs
RS St. Borromeus,Jl. Ir. H.Juanda No.100 Bandung,A,,Kota Bandung,Jawa Barat,-6.893981000000000,107.613000000000000,rs
RSIA Tedja,Jl. RE. Martadinata 97 Bandung,O,,Kota Bandung,Jawa Barat,-6.905753000000000,107.620006000000000,rs
RSUD Jampang Kulon,"Jl. Cibarusah No.1 Jampang Kulon,Kab.Sukabumi",A,D,Sukabumi,Jawa Barat,-6.919600000000000,106.927200000000000,rs
RSU Cianjur,Jl. Rumah Sakit No.1 Cianjur,A,B,Cianjur,Jawa Barat,-6.812192000000000,107.141036000000000,rs
RS Siloam Glenegles,Jl. MH Thamrin Kav.105 Bekasi,A,C,Bekasi,Jawa Barat,-6.331439000000000,107.135000000000000,rs
RS KCK Pindad,Jl. Jend Gatot Subroto Bandung,Umum,D,Kota Bandung,Jawa Barat,-6.925456000000000,107.631350000000000,rs
RSK Bedah Bina Sehat,Jl. Raya Dayeuh Kolot No.325 Bandung,K,D,Kota Bandung,Jawa Barat,-6.986089000000000,107.624000000000000,rs
RS Karya Husada,Jl. Jend. A.Yani No.89 Cikampek,A,C,Karawang,Jawa Barat,-6.401350000000000,107.444000000000000,rs
RS Mata Cicendo,Jl. Cicendo No.4 Bandung,D,A,Kota Bandung,Jawa Barat,-6.909900000000000,107.604000000000000,rs
RSIA &quot;Melinda Hospital&quot;,"Jl. Pajajaran No.46 Kel Pasirkaliki,Kota Bandung",O,,Kota Bandung,Jawa Barat,-6.906814000000000,107.603361000000000,rs
RSB Muhammadiyah Kodya Cirebon,Jl. Dr. W.Sudirohusodo Cirebon,Khusus Bersalin,D,Kota Cirebon,Jawa Barat,-6.716667000000000,108.566667000000000,rs
RSU Pandeglang,Jln.Raya Labuan KM 5 Cikoneng,A,C,Pandeglang,Banten,-7.317750000000000,108.281906000000000,rs
RSUD Gunung Jati,Jl. Kesambi No.56 Cirebon,Badan Layanan Daerah,B,Kota Cirebon,Jawa Barat,-6.731181000000000,108.555886000000000,rs
RSK Bedah Budi Asta,Jl. Kalitanjung No.51 Cirebon,Swata,D,Kota Cirebon,Jawa Barat,-6.747719000000000,108.535000000000000,rs
RS Mitra Keluarga Depok,"Jl. Margonda Raya, Jawa Barat",A,C,,Jawa Barat,-6.394406000000000,106.823867000000000,rs
RS Pelabuhan Cirebon,Jl. Sisingamangaraja No.45 Cirebon,Swasta,C,Kota Cirebon,Jawa Barat,-6.713447000000000,108.567300000000000,rs
RSB Putera Bahagia,Jl. Ciremai Raya Cirebon,RSU,C,Kota Cirebon,Jawa Barat,-6.716667000000000,108.566667000000000,rs
Rumkit Tk III Ciremai Cirebon,Jl. Kesambi 237 Cirebon,A,3,Kota Cirebon,Jawa Barat,-6.737986000000000,108.549700000000000,rs
RS Budi Luhur,Kebon Pelok Harjamukti Cirebon,Umum,D,Kota Cirebon,Jawa Barat,-6.763033000000000,108.531078000000000,rs
RSUD Tasikmalaya,"Jl. Rancamaya Singaparna, Tasikmalaya",A,D,,Jawa Barat,-7.332606000000000,108.225456000000000,rs
RS Advent Bandung,Jl. Cihampelas 161 Bandung,A,B,Kota Bandung,Jawa Barat,-6.892069000000000,107.604000000000000,rs
RSK Bedah Budi Kasih,Jl. Raya Majalengka-Kadipaten Km.7,K,,Majalengka,Jawa Barat,-6.765569000000000,108.167464000000000,rs
RS Bina Husada,Jl. Mayor Oking No.101 Km 01 Cibinong - Bogor,A,C,Bogor,Jawa Barat,-6.473133000000000,106.863339000000000,rs
RSU Bakhti Medicare,"Jl. Raya Siliwangi No.186B, Cicurug - Sukabumi",A,A,,Jawa Barat,-6.778083000000000,106.786481000000000,rs
RSU Ciawi,Jl. Raya Puncak 479 Ciawi Bogor,A,B,Bogor,Jawa Barat,-6.653889000000000,106.873819000000000,rs
RSUD Indramayu,Jl. Rumah Sakit No. 1 Indramayu,A,B,Indramayu,Jawa Barat,-6.392694000000000,108.287544000000000,rs
RS Islam Tasikmalaya,Jl. Rancamaya Blok B-2 Cikunten,A,,Tasikmalaya,Jawa Barat,-7.346100000000000,108.119947000000000,rs
RSUD Bayu Asih,Jl. Veteran No. 39 Purwakarta,A,C,Purwakarta,Jawa Barat,-6.525947000000000,107.447672000000000,rs
RSU Cibinong,Jl. KSR Dadi Kusmayadi No. 27 Bogor,A,B,Kab Bogor,Jawa Barat,-6.473292000000000,106.831211000000000,rs
RSUD Waled,"Jl. Kesehatan No. 4 Waled, Cirebon",A,B,Cirebon,Jawa Barat,-6.914228000000000,108.717822000000000,rs
RSUD Bekasi,Jl. Pramuka No. 55 Bekasi,A,B,KOTA BEKASI,Jawa Barat,-6.268111000000000,107.082497000000000,rs
RSU Mitra Keluarga Bekasi Barat,Jl. Raya A Yani Bekasi,A,,KOTA BEKASI,Jawa Barat,-6.240947000000000,106.992736000000000,rs
RSIA Permata Cibubur,"Jl. Alternatif Cibubur - Cilenungsi No. 6A, Kec. Jati Sampurna, Bekasi",O,,Bekasi,Jawa Barat,-6.375661000000000,106.911000000000000,rs
RS PMI Bogor,Jl. Raya Pajajaran No. 80 Bogor,A,,Kota Bogor,Jawa Barat,-6.573958000000000,106.827203000000000,rs
RS Azra,"Jl. Raya Pajajaran No.219, Bogor",A,,Kota Bogor,Jawa Barat,-6.579033000000000,106.807489000000000,rs
RS Kebonjati,Jl. Kebonjati 152 Bandung,A,C,Bandung,Jawa Barat,-6.916086000000000,107.596258000000000,rs
RS Bungsu,Jl. Veteran No. 6 Bandung,A,,Bandung,Jawa Barat,-6.918519000000000,107.613000000000000,rs
RS Permata Medical Center,Jl Raya Panyindangan Wetan,A,D,Indramayu,Jawa Barat,-6.392694000000000,108.287544000000000,rs
RSU Betha Medika,"Jl. Raya Cisaat No.595, Sukabumi",A,,Sukabumi,Jawa Barat,-6.905872000000000,106.871750000000000,rs
RS Al - Arif,"Jl. R.E. Martadinata No.158 B, Baregdeg - Ciamis",A,,Ciamis,Jawa Barat,-6.444683000000000,106.846250000000000,rs
RS Juanda Kuningan,"Jl. Ir. H. Juanda No. 107, Kuningan",A,,Kuningan,Jawa Barat,-6.973214000000000,108.491236000000000,rs
Rumkit Bhayangkara Indramayu,"Jl. Raya Pantura Km.73-75, Losarang Indramayu",A,4,Indramayu,Jawa Barat,-6.382319000000000,108.151636000000000,rs
RS Efarina Etaham,"Jl. Bungursari No.1, Purwakarta",A,B,Purwakarta,Jawa Barat,-6.488683000000000,107.477250000000000,rs
RS Dewi Sri,Jl. Arif Rahman Hakim Karawang,A,,Karawang,Jawa Barat,-6.304214000000000,107.297756000000000,rs
RSU Lamaran Medical Center,"Jl. Syech Quro No.14, Palumbonsari - Lamaran Karawang",A,,Karawang,Jawa Barat,-6.308367000000000,107.320936000000000,rs
RS Sentosa,"Jl. Palhlawan No. 60, Duren Jaya Bekasi",A,,KOTA BEKASI,Jawa Barat,-6.242769000000000,107.026000000000000,rs
RS Permata Bekasi,"Jl. Legenda Raya No.9 RT.001 Rw.011 Mustika Jaya, Bekasi",A,,KOTA BEKASI,Jawa Barat,-6.277694000000000,107.044203000000000,rs
RS Medirossa Cikarang,"Jl. Industri Tegal Gede No.09, Cikarang Selatan Bekasi",D,,Bekasi,Jawa Barat,-6.298819000000000,107.145000000000000,rs
RS Kartika Husada,"Jl. Raya Mangunjaya No.07 Kp.Rukem,Tambun - Bekasi",A,,Bekasi,Jawa Barat,-6.244592000000000,107.064625000000000,rs
RS Karya Medika II,Jl. Sultan Hasanuddin No.63 Kec. Tambun Selatan,A,,Bekasi,Jawa Barat,-6.264219000000000,107.068000000000000,rs
RSIA Melania,"Jl. Pahlawan No.91, Kota Bogor",O,,Bogor,Jawa Barat,-6.611417000000000,106.800692000000000,rs
RS Kartika Medical Center,"Jl. Jenderal Ahmad Yani No.18 A , Sukabumi",A,,Sukabumi,Jawa Barat,-6.922156000000000,106.927228000000000,rs
RSB Klinik Bahagia,"Jl. Pasundan No.93, Sukabumi",C,,Sukabumi,Jawa Barat,-6.924286000000000,106.925669000000000,rs
RSIA Karunia Bunda,"Jl. Raya Jatiwaringin No.133, Pd Gede Bekasi",O,-,Bekasi,Jawa Barat,-6.275850000000000,106.913000000000000,rs
RSIA Masmitra Jatimakmur,"Jl. Kelurahan Jati Makmur No.40, Pondok Gede Kota Bekasi",A,-,Bekasi,Jawa Barat,-6.285186000000000,106.926606000000000,rs
RSB Juwita,"Jl. M. Hasibuan No.78, Bekasi Timur",C,,Bekasi,Jawa Barat,-6.252042000000000,107.001981000000000,rs
RS Sentra Medika,Jl. Raya Bogor KM. Cisalak - Depok,A,-,Depok,Jawa Barat,-6.390831000000000,106.865000000000000,rs
RS Mitra Anugrah Lestari,"Jl. Cibaligo No.76, Cimahi",A,,Cimahi,Jawa Barat,-6.900622000000000,107.555842000000000,rs
RS Paru Dr. Goenawan Partowidigdo Cisarua,Jl. Raya Puncak Cisarua Bogor,F,A,Bogor,Jawa Barat,-6.687447000000000,106.939044000000000,rs
RS Tugu Ibu,Jl. Raya Bogor Km 29 Cimanggis - Depok,A,C,Bogor,Jawa Barat,-6.356561000000000,106.860000000000000,rs
RS Gunung Salak,Jl. Cibungbulang Leuwiliang,A,,Bogor,Jawa Barat,-6.572306000000000,106.665006000000000,rs
RSIA Hermina Depok,Jl. Raya Siliwngi No. 50 Pancoran Mas Depok,O,,Bogor,Jawa Barat,-6.399917000000000,106.825125000000000,rs
RSIA Citra Insani,Jl. Raya Parung Bogor No.242 Bogor,O,,Bogor,Jawa Barat,-6.484819000000000,106.735264000000000,rs
RSIA Tumbuh Kembang,Jl. Raya Bogor Km.31 No.23 Bogor,O,,Bogor,Jawa Barat,-6.371686000000000,106.861439000000000,rs
RSIA Mary Cileungsih Hijau,Jl. Raya Narogong Cileungsi Bogor,O,,Bogor,Jawa Barat,-6.399747000000000,106.969478000000000,rs
RSB Tunas Jaya Cibinong,Jl. Kelurahan Pabuaran No.24 Cibinong,C,,Bogor,Jawa Barat,-6.448192000000000,106.851928000000000,rs
RSK Bedah Plastik Aibee Aesthetic Center,Jl. Pasir Angin Gadog Ciawi Bogor,K,,Bogor,Jawa Barat,-6.649044000000000,106.865175000000000,rs
RSU Bunda Margonda,Jl. Margonda Raya KM 3 RT.02/03,A,,Bogor,Jawa Barat,-6.380842000000000,106.830556000000000,rs
RSU MH. Thamrin,"Jl. Raya Narogong Km.16, Limus Nunggal Cileungsi,Bogor",A,,Bogor,Jawa Barat,-6.432275000000000,106.949039000000000,rs
RS Islam Bogor,"Jl. Perdana Bogor No.22,Kedung Badak - Bogor",A,,Bogor,Jawa Barat,-6.558344000000000,106.791867000000000,rs
RSU Sekarwangi,Jl. Siliwangi Cibadak Sukabumi,A,C,Sukabumi,Jawa Barat,-6.894764000000000,106.786000000000000,rs
RS Islam Sukabumi,Jl. Cibolang Cisaat Sukabumi,A,,Sukabumi,Jawa Barat,-6.915528000000000,106.931872000000000,rs
RSU Pelabuhan Ratu,Jl. Rumah Sakit Pelabuhan Ratu,A,C,Sukabumi,Jawa Barat,-6.992372000000000,106.557292000000000,rs
RSU &quot;Hermina&quot;,"Jl. Jl. R.A. Kosasih Cimahpar Sukaraja,Kab. Sukabumi",A,,Sukabumi,Jawa Barat,-6.919403000000000,106.954544000000000,rs
RSB Al-Afiah,Jl. Siti Jenab 49 Cianjur,C,,Cianjur,Jawa Barat,-6.821583000000000,107.138964000000000,rs
RSUD Cimacan,"Jl. Raya Cimacan No.17, Cianjur",A,D,Cianjur,Jawa Barat,-6.720447000000000,107.031808000000000,rs
RSU Majalaya,Jl. Cipaku No.87 Paseh Sukabumi,A,C,Bandung,Jawa Barat,-7.048658000000000,107.772278000000000,rs
RSU Cibabat,Jl. Jend. H. Amir Machmud No. 140,A,B,Bandung,Jawa Barat,-6.879650000000000,107.550836000000000,rs
RS Jiwa Cimahi,Jl. Kolonel Masturi Cimahi,B,B,Bandung,Jawa Barat,-6.810542000000000,107.563956000000000,rs
RS Max I Salhutera,Kec Ciwidey Kab Bandung,A,,Bandung,Jawa Barat,-6.914675000000000,107.670764000000000,rs
RS Mitra Kasih,Jl. Raya Cibabat No.341 Cimahi,A,,Bandung,Jawa Barat,-6.884378000000000,107.552908000000000,rs
RS Islam Al Ihsan,Jl. Bale Endah Kab Bandung,A,B,Bandung,Jawa Barat,-7.008100000000000,107.624000000000000,rs
RSUD Soreang,Jl. Alun-Alun Utara Soreang,A,C,Bandung,Jawa Barat,-7.026042000000000,107.517144000000000,rs
RSUD Dr. Slamet,Jl. Rumah Sakit No.10 Garut,A,B,Garut,Jawa Barat,-7.219706000000000,107.897131000000000,rs
Rumkit Tk IV Guntur Garut,Jl. Bratayuda 101 Garut,A,4,Garut,Jawa Barat,-7.222578000000000,107.911128000000000,rs
RSU Tasikmalaya,Jl. Rumah Sakit 33 Tasikmalaya,A,B,Tasikmalaya,Jawa Barat,-7.332544000000000,108.224933000000000,rs
RSB Pamela,Jl. Tentara Pelajar Tasikmalaya,C,,Tasikmalaya,Jawa Barat,-7.330981000000000,108.222583000000000,rs
RS Jasa Kartini,Jl. Sarianingrat 2 Tasikmalaya,A,,Tasikmalaya,Jawa Barat,-7.326289000000000,108.222461000000000,rs
RS Prasetya Bunda,"Jl. Ir.H. Juanda No.1,Tasikmalaya",A,,Kota Tasikmalaya,Jawa Barat,-7.305178000000000,108.204906000000000,rs
RSUD Ciamis,Jl. Rumah Sakit No.76 Ciamis,A,C,Ciamis,Jawa Barat,-7.329803000000000,108.359325000000000,rs
RSUD Banjar,Jl. Rumah Sakit No. 5 Banjar,A,B,Ciamis,Jawa Barat,-7.369864000000000,108.572550000000000,rs
RS Nirmala,"Jl. Raya Ciamis - Kawali KM.5,Petirhilir",A,,Ciamis,Jawa Barat,-7.305894000000000,108.359936000000000,rs
RS Permata Bunda,Jl. Mr. Iwa Kusumasomantri No.1 Ciamis,A,,Ciamis,Jawa Barat,-7.331278000000000,108.362344000000000,rs
RSUD Kuningan,Jl. Sudirman No. 68 Kuningan,A,B,Kuningan,Jawa Barat,-6.982614000000000,108.487425000000000,rs
RS Wijaya Kusumah,Jl. RE Martadinata 172 Kuningan,A,C,Kuningan,Jawa Barat,-6.970511000000000,108.506492000000000,rs
RS Sekar Kamulyan,"Jl. Raya Cigugur Kuningan,Jakbar",A,,Kuningan,Jawa Barat,-6.970139000000000,108.456033000000000,rs
RS Pertamina Klayan,Jl. Raya Klayan Cirebon,A,,Cirebon,Jawa Barat,-6.685775000000000,108.548833000000000,rs
RSTP Sidawangi,Jl. Sumber-Mandirancan Cirebon,F,C,Cirebon,Jawa Barat,-6.750111000000000,108.524942000000000,rs
