RSGM Hang Tuah Surabaya,FKG Hang Tuah Surabaya,T,,Surabaya,Jawa Timur,-7.290911000000000,112.792803000000000,rs
RS Islam Darus Syifa,"Jl. Raya Benowo No.5,Surabaya",A,C,Surabaya,Jawa Timur,-7.235381000000000,112.613000000000000,rs
RS Bhayangkara H.S.Samsoeri Mertojoso,"Jl. Achmad Yani No.16,Surabaya",A,4,Surabaya,Jawa Timur,-7.340028000000000,112.700261000000000,rs
RSUD Landak,Jl. Pemuda Ngabang,A,D,Landak,Kalimantan Barat,-7.042153000000000,112.896797000000000,rs
RSU Bunda Surabaya,,A,,,Jawa Timur,-7.227969000000000,112.741000000000000,rs
RSUD Kab.Bengkayang,Jl. Sanggau Ledo No.20 Bengkayang,A,D,Bengkayang,Kalimantan Barat,-0.278781000000000,111.475286000000000,rs
RSU Dr Rubini Mempawah,Jl. Dr Rubini Mempawah,A,C,Pontianak,Kalimantan Barat,-0.022522000000000,109.330308000000000,rs
RSU Sanggau,Jl. Jend Sudirman Sanggau,A,C,Sanggau,Kalimantan Barat,0.119275000000000,110.597297000000000,rs
RS PTPN XIII Parindu,Binjai Kec.Tayan Hulu Sanggau,A,,Sanggau,Kalimantan Barat,0.119275000000000,110.597297000000000,rs
RSU Dr. Agusdjam Ketapang,Jl. Panjaitan No.1 Ketapang,A,C,Ketapang,Kalimantan Barat,-1.859097000000000,109.971900000000000,rs
RSUD Kasongan,"Jl. Rumah Sakit No.1,Kasongan",A,C,,Kalimantan Tengah,-1.681489000000000,113.382353000000000,rs
RSUD Dr Murjani Sampit,Jl. H M Arsyad No. 65 Sampit,A,B,,Kalimantan Tengah,-2.540014000000000,112.952069000000000,rs
RSUD Dr H Soemarno S,Jl. Tambun Bungai Kuala Kapuas,A,C,Kapuas,Kalimantan Tengah,-3.002806000000000,114.391022000000000,rs
RSUD Poso,Jl. Jen.Sudirman No.33 Poso,A,C,Poso,Sulawesi Tengah,-0.200000000000000,113.500000000000000,rs
RSU Muara Teweh,Jl. Yetro Sinseng Muara Teweh,A,C,Barito Utara,Kalimantan Tengah,-1.433333000000000,114.450000000000000,rs
RSUD Sukamara,"Jl. Tjilik Riwut KM 5,5 Sukamara",A,D,Sukamara,Kalimantan Tengah,-2.716667000000000,111.183333000000000,rs
RSUD Balangan,"Jl. Lingkar Timur Km.1,7 Paringin Kab.Balangan",A,D,Balangan,Kalimantan Selatan,-2.321589000000000,112.746394000000000,rs
RS PTP XII Bakti Husada,Krikilan Glenmore Banyuwangi,A,,Banyuwangi,Jawa Timur,-8.308055000000000,114.014331000000000,rs
RSUD Sultan Imanuddin,Jl. St Syahrir 17 Pangkalan Bun,A,C,Waringin Barat,Kalimantan Tengah,-1.681489000000000,113.382353000000000,rs
RSUD Kuala Kurun,Jl. Cilik Riwut No.43 Kuala Kurun Kalteng,A,D,Kapuas,Kalimantan Tengah,-1.681486000000000,113.382353000000000,rs
RSUD Buntok,"Jl. Patianom No.6, Buntok",A,C,Barito Selatan,Kalimantan Tengah,-1.744833000000000,114.821800000000000,rs
RSUD Tamiang Layang,Jl. Nansarunai Tamiang Layang,A,D,Barito Selatan,Kalimantan Tengah,-1.681489000000000,113.382353000000000,rs
RSUD Puruk Cahu,"Jl. A. Yani No. 497, Puruk Cahu",A,D,Barito Utara,Kalimantan Tengah,-1.681489000000000,113.382353000000000,rs
RSUD Lamandau,"Jl. Tjilik Riwut No.11,Nanga Bulik",A,D,Lamandau,Kalimantan Tengah,-1.681489000000000,113.382353000000000,rs
RSUD Kuala Pembuang,"Jl. A.Yani No.30,Kuala Pembuang",A,D,Seruyan,Kalimantan Tengah,-2.529681000000000,112.956189000000000,rs
RSUD Pulang Pisau,"Jl. Pemda No. 107, Pulang Pisau",A,D,Pulang Pisau,Kalimantan Tengah,-1.681489000000000,113.382353000000000,rs
RSUD Dr Doris Sylvanus,Jl. Tambun Bungai No.4 Palangkaraya,A,B,Palangka Raya,Kalimantan Tengah,-1.593422000000000,113.231489000000000,rs
Rumkit Tk.IV Palangkaraya,Jl. Diponegoro Palangkaraya,A,4,Palangka Raya,Kalimantan Tengah,-1.593422000000000,113.231489000000000,rs
RSJ Sambang Lihum,Jl. Purwosari Km 4 Tamban Kab Batola,B,A,Barito Kuala,Kalimantan Selatan,-0.789275000000000,113.921000000000000,rs
RSUD Abdul Aziz/Marabahan,"Jl. Jend Sudirman No.10,Marabahan",A,C,Barito Kuala,Kalimantan Selatan,-0.789275000000000,113.921000000000000,rs
RSUD Tarakan,"Jl. P. Irian Tengah,Tarakan",A,B,Tarakan,Kalimantan Timur,3.276089000000000,117.619400000000000,rs
RSUD Sangatta,Jl. Cut Nyak Dien No.1 Kutai Timur,A,C,Kutai Timur,Kalimantan Timur,0.520861000000000,117.435481000000000,rs
RS Dirgahayu,Jl. Merbabu No.40 Samarinda,A,,,Kalimantan Timur,-0.502183000000000,117.153800000000000,rs
RSUD Kab. Nunukan,Jl. Sei Fatimah,A,D,Nunukan,Kalimantan Timur,4.142586000000000,117.648803000000000,rs
RS Islam Samarinda,"Jl. Gurami No.18,Samarinda",A,,Samarinda,Kalimantan Timur,-0.502183000000000,117.153800000000000,rs
RS Bergerak Kab.Malinau,Langgap-Malinau Selatan,A,D,malinau,Kalimantan Timur,3.584222000000000,116.647797000000000,rs
RSUD Kab. Malinau,Jl. Raya Respen Tubu Kec. Malinau Utara Kab. Malinau,A,D,Malinau,Kalimantan Timur,3.584222000000000,116.647797000000000,rs
Rumkit Bhayangkara Balikpapan,"Jl. Jend. Sudirman No.14, Balikpapan",A,4,Balikpapan,Kalimantan Timur,-1.265386000000000,116.831200000000000,rs
RS Jiwa Atmamahusada Mahakam/Samarinda,Jl.Kakap No.23 Samarinda,B,B,Samarinda,Kalimantan Timur,-0.502183000000000,117.153800000000000,rs
RSUD Kota Bontang,"Jl. S. Parman No.01, Kota Bontang",A,B,Bontang,Kalimantan Timur,0.135597000000000,117.498597000000000,rs
RS Restu Ibu,"Jl. Proklamasi No.31,Padang",A,,Padang,Sumatera Barat,-1.271439000000000,116.837003000000000,rs
RSUD H Boejasin Pelaihari,Jl. Hadji Boejasin No.68 Kab. Tanah Laut,A,C,Tanah Laut,Kalimantan Selatan,3.354681000000000,117.596539000000000,rs
RSUD Panglima Sebaya,Jl. Ciptomangunkusumo No.2 T Grogot,A,C,Pasir,Kalimantan Timur,-1.971347000000000,116.228797000000000,rs
RSUD AM Parikesit Tenggarong,Jl. Imam Bonjol Tenggarong,A,B,Kutai Barat,Kalimantan Timur,-0.417325000000000,116.981400000000000,rs
RS Kusta Tenggarong,Jl. Tanjung Kupang Tenggarong,G,,Kutai Barat,Kalimantan Timur,-0.417325000000000,116.981400000000000,rs
RS Harapan Insan Sendawar,Jl. Mawar Desa Sendawar Kutai,A,C,Kutai Barat,Kalimantan Timur,-0.417325000000000,116.981400000000000,rs
RSUD Aji Batara Agung Dewa Sakti,Jl. Balikpapan - Handil II Samboja,A,C,Kutai Barat,Kalimantan Timur,-0.896722000000000,116.937103000000000,rs
RS St Yosef Tering,"Tering Baru, Kab.Kutai",A,,Kutai Kertanegara,Kalimantan Timur,-0.476011000000000,117.051258000000000,rs
RSUD Tanjung Selor,Jl. Cendrawasih Tanjung.Selor,A,C,Kutai Timur,Kalimantan Timur,2.850000000000000,117.366667000000000,rs
RSU Dr. Abd.Rivai Berau,Jl. Pulau Panjang No.275 Tanjung Redeb,A,C,Berau,Kalimantan Timur,2.162331000000000,117.696203000000000,rs
RS Pertamina Bunyu,Jl.Serdang P.Bunyu,A,,Bulongan,Kalimantan Timur,3.519144000000000,117.819419000000000,rs
RSUD Kab.Penajam Paser Utara,Jl. Propinsi Km.09 Kab.Penajam Paser Utara,A,C,Penajam Paser Utara,Kalimantan Timur,1.640631000000000,116.419389000000000,rs
RS Pertamina Balikpapan,Jl. Jend Sudirman Balikpapan,A,,Balikpapan,Kalimantan Timur,-1.274083000000000,116.852569000000000,rs
Rumkit Tk.III Dr R Hardjanto,Jl. Tanjungpura I Balikpapan,A,3,Balikpapan,Kalimantan Timur,-1.269889000000000,116.858000000000000,rs
RS PT ITCI,Jl. Rumah Sakit Balikpapan,A,,Balikpapan,Kalimantan Timur,-1.265386000000000,116.831200000000000,rs
RS Fatima Saumlaki,Jl.Komplek Misi Saumlaki Maluku Tenggara Barat,A,D,Maluku Tenggara,Maluku,-3.238461000000000,130.145272000000000,rs
RS St Yusuph Elat,Kei Besar Kab Maluku Tenggara,A,D,Maluku Tenggara,Maluku,-3.238461000000000,130.145272000000000,rs
RSK Bedah Bakti Rahayu,Jl. Ahmad Yani Ambon,Umum,D,Kota Ambon,Maluku,-3.706894000000000,128.162603000000000,rs
RSU Piru,jln. Arteri Piru,A,D,Seram Bagian Barat,Maluku,-3.238461000000000,130.145272000000000,rs
RSU Dr M Haulussy Ambon,Jl. Dr Kayadoe Ambon,A,B,Ambon,Maluku,-3.706894000000000,128.162603000000000,rs
RSU Tual,Jl. Merdeka Ohoijang Tual,A,C,Maluku Tenggara,Maluku,-5.637719000000000,132.662239000000000,rs
RS Hati Kudus Langgur,Langgur Kab.Maluku Tenggara,A,,Maluku Tenggara,Maluku,-5.666667000000000,132.716661000000000,rs
RSU Namlea,Jl. Anggrek Namlea Buru Utara,A,D,Maluku Tengah,Maluku,-3.233397000000000,127.085900000000000,rs
RSUD Cendrawasih Dobo,"Jl. Depnaker Km.6,Kepulauan Aru",A,D,Kepulauan Aru,Maluku,-6.000000000000000,134.500000000000000,rs
RSUD Kab.Seram Bagian Timur (Bula),"Jl. Wailola No.11-12 Bula,Kab.Seram Bag.Timur",A,D,Seram Bagian Timur,Maluku,-3.109681000000000,130.498506000000000,rs
Rumkit Tk.III JA. Latumeten,"Jl. Dr Tamaela No.2,Ambon",A,3,Ambon,Maluku,-3.656069000000000,128.166419000000000,rs
RS AL Ambon,Daeral 9 Halong Ambon,A,4,Ambon,Maluku,-3.626403000000000,128.217719000000000,rs
RS Lanu Patimura,Lanu Pattimura Ambon,A,4,Ambon,Maluku,-3.704997000000000,128.088881000000000,rs
RSKD Ambon,Jl. Laksdya Leo Wattimena Ambon,B,B,Ambon,Maluku,-3.656069000000000,128.166419000000000,rs
RS Hative,Tantui Ambon,A,,Ambon,Maluku,-3.656069000000000,128.166419000000000,rs
RS GPM Ambon,Jl. Anthonie Rhebok Ambon,A,,Ambon,Maluku,-3.656069000000000,128.166419000000000,rs
RS Al Fatah,Jl.Sultan Babullah 2 Ambon,A,,Ambon,Maluku,-3.701075000000000,128.175114000000000,rs
RS Islam Bina Warga,"Jl. Pemuda No.131 Keluarahan Toboleu, Ternate",A,D,Kota Madya Ternate,Maluku Utara,0.788067000000000,127.377156000000000,rs
RS Medika Harifalm Ternate,"Jl. Zainal Abidin Syah No.25, Ternate",A,D,Kota Ternate,Maluku Utara,0.788067000000000,127.377156000000000,rs
RSU Kota Tidore Kepulauan,Jl. Sultan mansyur No 11 Indonesiana Tidore maluku Utara,A,C,Kota Tidore Kpulauan,Maluku Utara,0.683333000000000,127.400000000000000,rs
RSUD Maba,Jl. Trans Halmahera Kota maba,A,D,Halmahera Timur,Maluku Utara,0.600000000000000,127.866667000000000,rs
RSUD Weda,"Jl. Raya Weda, Kab. Halmahera Tengah",A,D,Halmahera tengah,Maluku Utara,0.624608000000000,127.917347000000000,rs
RSUD Kab. Pulau Morotai,Jl. Puskesmas No.5 Desa Yayasan,A,D,mOROTAI,Maluku Utara,2.287261000000000,128.514317000000000,rs
RSU Daerah Tobelo,Jl. Lanbouw Samsungi Tobelo Halmahera Utara,A,C,Halmahera Barat,Maluku Utara,0.600000000000000,127.866667000000000,rs
RSUD Jailolo,"Jl.Raya Acango-Jailolo,Halmahera Barat",A,D,Halmahera Barat,Maluku Utara,1.070792000000000,127.465203000000000,rs
RS Bergerak Kab.Halmahera Utara,,A,D,Halmahera Barat,Maluku Utara,0.600000000000000,127.866667000000000,rs
RS Lanu Morotai,Morotai Kab Maluku Utara,A,4,Halmahera Tengah,Maluku Utara,2.365667000000000,128.400836000000000,rs
RSUD Sanana,"Jln. Dr. Sibarani - Falahu, Kep. Sula",A,D,Kepulauan Sula,Maluku Utara,-2.233700000000000,125.936994000000000,rs
RSU Ternate,Jl. Tanah Tinggi Ternate,A,B,Ternate,Maluku Utara,0.788067000000000,127.377156000000000,rs
Rumkit Tk.IV Ternate,"Jl. Ais Nasution No.2, Ternate",A,4,Ternate,Maluku Utara,0.788067000000000,127.377156000000000,rs
RSU Dharma Ibu Ternate,"Jl. Pahlawan Revolusi No.5, Ternate",A,,Ternate,Maluku Utara,0.788067000000000,127.377156000000000,rs
RSUD Patut Patuh Patju,"Jl. H. Lalu Anggrat BA No. 2, Gerung",A,C,Lombok Barat,Nusa Tenggara Barat,-8.691361000000000,116.112100000000000,rs
RSU Dr R Sudjono,Jl. Prof M Yamin SHNo.55 Selong,A,C,Lombok Timur,Nusa Tenggara Barat,-8.583647000000000,116.550581000000000,rs
RSU Mataram,"Jl. Pejanggik No.6, Mataram",A,B,Mataram,Nusa Tenggara Barat,-8.582411000000000,116.112000000000000,rs
RSUD Kota Mataram,Jl. Bung Karna Pagutan Mataram,A,D,Mataram,Nusa Tenggara Barat,-8.581825000000000,116.106833000000000,rs
RSU Praya,Jl. Basuki Rahmat No. 11 Praya,A,C,Lombok Tengah,Nusa Tenggara Barat,-8.710367000000000,116.272397000000000,rs
RS Islam Yatofa,"Jl. Raya Bodak,Praya Lombok Tengah",A,,Lombok Tengah,Nusa Tenggara Barat,-8.694622000000000,116.277708000000000,rs
RS Kusta Sepolong,Sepolong Kab Lombok Timur,G,,Lombok Timur,Nusa Tenggara Barat,-8.513447000000000,116.560986000000000,rs
RSU Sumbawa Besar,Jl. Garuda No. 5 Sumbawa Besar,A,C,Sumbawa,Nusa Tenggara Barat,-8.504042000000000,117.428497000000000,rs
RSU Dompu,"Jl. Kesehatan No. 1 Dompu, NTB",A,C,Dompu,Nusa Tenggara Barat,-8.545436000000000,118.445800000000000,rs
RSU Raba,Jl. Langsat No. 1 Raba Kab Bima,A,C,Bima,Nusa Tenggara Barat,-8.460567000000000,118.727403000000000,rs
RS Kusta Panda,Panda Kec Belo Kab Bima,G,,Bima,Nusa Tenggara Barat,-8.460567000000000,118.727403000000000,rs
Rumkit Tk.IV Wira Bhakti Mataram,Jl. Cokroaminoto 7 Mataram,A,4,Mataram,Nusa Tenggara Barat,-8.582158000000000,116.108761000000000,rs
RS Islam Siti Hajar,Jl. Catur Warga Mataram,A,,Mataram,Nusa Tenggara Barat,-8.585761000000000,116.112742000000000,rs
RS Sint Antonius Ampenan,Jl. Koperasi 61 Ampenan,A,,Mataram,Nusa Tenggara Barat,-8.568617000000000,116.084089000000000,rs
RS Jiwa Mataram,Jl. A Yani 1 Selagalas Mataram,B,B,Mataram,Nusa Tenggara Barat,-8.576531000000000,116.145764000000000,rs
RS Bhayangkara Mataram,"Jl. Langko No.64,Mataram",A,4,Mataram,Nusa Tenggara Barat,-8.580564000000000,116.092764000000000,rs
RS Risa Sentra Medika,"Jl. Pejanggik No.115 Cakranegara,Mataram",A,,Mataram,Nusa Tenggara Barat,-8.583992000000000,116.113433000000000,rs
RS ST Rafael Cancar,"Cancar Ruteng,Kab.Manggarai",A,D,Manggarai,Nusa Tenggara Timur,-8.657383000000000,121.079369000000000,rs
RSU Dr TC Hillers Maumere,Jl. Kesehatan Maumere,A,C,Sikka,Nusa Tenggara Timur,-8.620842000000000,122.207703000000000,rs
RS St Elizabeth Lela,"Lela Maumerem,Kab.Sikka",A,,Sikka,Nusa Tenggara Timur,-8.657383000000000,121.079369000000000,rs
RSU Soe,Jl. Boegenville No.7 Soe - Timor Tengah Selatan,A,D,Timor Tengah Selatan,Nusa Tenggara Timur,-9.696447000000000,124.481181000000000,rs
RS Lendemoripa,Jl. El Tari No.2 Waikabubak,A,D,Sumba Barat,Nusa Tenggara Timur,-9.409536000000000,119.245992000000000,rs
RS Kristen Lindimara,"Jl. Prof.DR WZ. Johannes No.6,Waingapu",A,D,Sumba Timur,Nusa Tenggara Timur,-9.662806000000000,120.266900000000000,rs
RSUD Naibonat,"Jl. Timor Raya KM.37 Oelamasi, Kupang",A,C,Kab Kupang,Nusa Tenggara Timur,-10.184300000000000,123.594853000000000,rs
RS Bukit Lewoleba,"Lewoleba, Lembata NTT",A,-,Flores Timur,Nusa Tenggara Timur,-8.657383000000000,121.079369000000000,rs
RSUD Kota Kupang,Jl. Timor Raya Pasir Panjang,A,C,Kupang,Nusa Tenggara Timur,-10.184300000000000,123.594853000000000,rs
RSUD Rote Ndao Ba&#39;a,"Jl. Busa langga, Kab Kupang",A,D,Kupang,Nusa Tenggara Timur,-10.184300000000000,123.594853000000000,rs
RSUD Dr. P.P Magretti Saumlaki,Jl. Ir. Soekarno - Poros Utama,A,D,Maluku Tenggara,Maluku,-8.730128000000000,120.737783000000000,rs
RS Karitas Weetabula,"Weetebula,Kab.Sumba Barat",A,,Sumba Barat,Nusa Tenggara Timur,-8.657383000000000,121.079369000000000,rs
RSU Waikabubak,"Jl. Adhyaksa Km-IV,Sumba Barat",A,C,Sumba Barat,Nusa Tenggara Timur,-8.657383000000000,121.079369000000000,rs
RSUD Waingapu,"Jl. Adam Malik No.54, Hambala Waingapu",A,D,Sumba Timur,Nusa Tenggara Timur,-9.662806000000000,120.266900000000000,rs
RSU Imanuel Sumba,"Jl. Nangka No.4,Waingapu-Sumba Timur",A,,Sumba Timur,Nusa Tenggara Timur,-9.662806000000000,120.266900000000000,rs
RSUD Kefamenanu,Jl. Letjen Suprapto Kefamenanu,A,D,Timor Tengah Utara,Nusa Tenggara Timur,-9.437953000000000,124.471297000000000,rs
RSUD Belu,Jl. Dr Sutomo No. II Atambua,A,C,Belu,Nusa Tenggara Timur,-9.101069000000000,124.891000000000000,rs
RS Marianum Halilolik,"Jl. Paroki Roh Kudus, Kab.Belu",A,,Belu,Nusa Tenggara Timur,-9.101069000000000,124.891000000000000,rs
RS Sito Husada,"Jl. KH.Dewantara No.15,Atambua Belu",A,,Belu,Nusa Tenggara Timur,-9.333333000000000,124.900000000000000,rs
RS Penyangga Perbatasan Betun,Jl. Sukabihanawa Desa Kamanasa Kec.Malaka Tengah,A,D,Belu,Nusa Tenggara Timur,-9.101069000000000,124.891000000000000,rs
RSUD Alor,Jl. Dr Sutomo Kalabahi Kab Alor,A,D,Alor,Nusa Tenggara Timur,-8.250000000000000,124.750000000000000,rs
RS Bergerak Kab.Alor,,A,D,Alor,Nusa Tenggara Timur,-8.250000000000000,124.750000000000000,rs
RSU Larantuka,"Jl. Moh Hatta No.19,Kab.Flores Timur",A,D,Flores Timur,Nusa Tenggara Timur,-8.346411000000000,122.979169000000000,rs
RS Kusta Lembata,Lembata Kab Flores Timur,G,,Flores Timur,Nusa Tenggara Timur,-8.657383000000000,121.079369000000000,rs
RSUD Lewoleba,"Jl.Trans Lembata No.1,Lewoleba,Lembata",A,D,Flores Timur,Nusa Tenggara Timur,-8.373692000000000,123.400025000000000,rs
RSUD Ende,Jl. Prof Dr. WZ.Johanes Ende,A,C,Ende,Nusa Tenggara Timur,-8.854053000000000,121.654197000000000,rs
RS St Antonius Jopu,"Jopu Wolowaru, Ende- Flores",A,,Ende,Nusa Tenggara Timur,-8.854053000000000,121.654197000000000,rs
RSU Bajawa,"Jl. Diponegoro No. 5, Bajawa",A,D,Ngada,Nusa Tenggara Timur,-8.792325000000000,120.960603000000000,rs
RSU Ruteng,"Jl. Diponegoro No.16,Kab Manggarai",A,D,Manggarai,Nusa Tenggara Timur,-8.614364000000000,120.466500000000000,rs
RSU Prof Dr WZ Johanes,Jl. Dr Moch Hatta No. 19 Kupang,A,B,Kupang,Nusa Tenggara Timur,-10.184300000000000,123.594853000000000,rs
RS Tk.IV Wirasakti Kupang,"Jl. Dr.DR.Moch Hatta No.3,Kupang",A,4,Kupang,Nusa Tenggara Timur,-10.184300000000000,123.594853000000000,rs
RS Bhayangkara,Jl. Nangka No. 54 Kupang,A,4,Kupang,Nusa Tenggara Timur,-10.184300000000000,123.594853000000000,rs
RSU St. Gabriel Kewapante Sikka,Kewapante Kabupaten Sikka,A,0,,Nusa Tenggara Timur,-8.740206000000000,122.188797000000000,rs
RSU Oksibil,jl. Poros Kabiding No. 2 Oksibil,A,D,ASMAT,Papua,-5.080178000000000,140.635803000000000,rs
RSU Merauke,Jl. SukarjowirjopraNo.to Merauke,A,C,Merauke,Papua,-8.495994000000000,140.394500000000000,rs
RS Mitra Masy.Timika,"Jl.SP2-SP5 Timika, Mimika",A,,Mimika,Papua,-4.531389000000000,136.888333000000000,rs
RS Kusta Merauke,Jl. Garuda Mopa Merauke,G,,Merauke,Papua,-8.495994000000000,140.394500000000000,rs
RSU Wamena,Jl. Trikora Wamena,A,D,Merauke,Papua,-4.098333000000000,138.951661000000000,rs
RSUD Paniai,"Jl. Raya Madi KM.7,Paniai Timur",A,D,Paniai,Papua,-4.354503000000000,139.365314000000000,rs
RS Efata Angguruk,Angguruk Kab Jayawijaya,A,,Puncak Jaya,Papua,-4.083611000000000,137.184722000000000,rs
RS Immanuel,Kec Mulia Kab Puncak Jaya,A,,Puncak Jaya,Papua,-4.083611000000000,137.184722000000000,rs
RSU Serui,Jl. Dr Sam Ratulangi Serui,A,D,Pemkab Yapen Waropen,Papua,-1.878014000000000,136.236664000000000,rs
RSUD Kab. Mimika,Jl. Yos Sudarso Kab. Mimika,A,D,Mimika,Papua,-4.354503000000000,139.365314000000000,rs
RS Bergerak Kab.Boven Digoel,,A,D,Boven Digoel,Papua,-6.083333000000000,140.283333000000000,rs
RSUD Kab.Keerom,"Jl. Bhayangkara,Kp. Asyaman,Distrik Arso,Kab.Keerom",A,D,Keerom,Papua,-4.354503000000000,139.365314000000000,rs
RS Jiwa Abepura,Jl. Kesehatan II Abepura,B,C,Jayapura,Papua,-2.606119000000000,140.669000000000000,rs
RSUD Mulia,"Jl. Papua, Pruleme, Distrik Mulia Kabupaten Puncak Jaya",A,D,,Papua,-4.083611000000000,137.184722000000000,rs
RSUD Supiori,Jl. Raya Korido Marsram Supiori Timur - Supiori,A,D,,Papua,-0.750000000000000,135.500000000000000,rs
RSU Manokwari,Jl. Bhayangkara No.I Manokwari,A,C,Kaimana,Papua Barat,-3.660925000000000,133.774506000000000,rs
Rumkitban Manokwari,Jl. Brawijaya Kodim 1703 Manokwari,A,4,Kaimana,Papua Barat,-0.861522000000000,134.078797000000000,rs
RS AL Manokwari,Jl. Serma Suwandi MaNo.kwari,A,4,Kaimana,Papua Barat,-0.861522000000000,134.078797000000000,rs
RS Bergerak Waisai,,A,D,Teluk Wondama,Papua Barat,-1.336114000000000,133.174717000000000,rs
RSU SCHOLOO Keyen,Jl. Teminabuan - Ayamaru Kampung Keyen - Teminbauan,A,D,,Papua Barat,-1.450000000000000,132.016667000000000,rs
RSUD Siak,"Jl. Raja Kecik No.1 Kampung dalam,Siak Sri Indrapura",A,C,Siak,Riau,0.783256000000000,102.069800000000000,rs
RS Islam Ibnu Sina,"Jl. Melati No.60,Pekanbaru",A,c,,Riau,0.525631000000000,101.436500000000000,rs
"RSUD Arifin Achmad,Pekanbaru","Jl. Diponegoro No. 2, Pekanbaru",A,B,,Riau,0.520639000000000,101.452533000000000,rs
RSUD.Dr. R.M. Pratomo Bagansiapiapi,"Jl. Pahlawan No.13,Bagansiapiapi",A,C,Bengkalis,Riau,1.466544000000000,102.250906000000000,rs
RSAB Eria Bunda,"Jl. KH.Ahmad Dahlan No.163,Pekanbaru",O,,,Riau,0.512017000000000,101.438000000000000,rs
RSU Puri Husada Tembilahan,"Jl. Veteran 52,Hilir Tembilahan",A,C,Indragiri Hilir,Riau,-0.347106000000000,103.169197000000000,rs
RSIA Mutia Sari,Jl. Bathin Betuah No.1-A Simp.Padang Duri,O,,Bengkalis,Riau,1.466544000000000,102.250906000000000,rs
RS Tk IV Pekanbaru,"Jl. Kesehatan No. 2,Pekanbaru",A,4,Pekanbaru,Riau,0.533333000000000,101.450000000000000,rs
RS Awal Bros Pekanbaru,"Jl. Sudirman No.117,Pekanbaru",A,B,Pekanbaru,Riau,0.497103000000000,101.455800000000000,rs
RS Khusus Bedah & Kebidanan Syafira,"Jl. Jenderal Sudirman No.134, Pekanbaru",O,B,riau,Riau,0.504839000000000,101.452044000000000,rs
RSUD Kec.Mandau,"Jl. Stadion No.10 Duri,Bengkalis",A,D,Bengkalis,Riau,1.259619000000000,101.213097000000000,rs
RS Bina Kasih,"Jl. Samanhudi No.3-5,Pekanbaru",A,C,Pekanbaru,Riau,0.533333000000000,101.450000000000000,rs
RSU Bangkinang,"Jl. A Rahman Saleh,Bangkinang",A,C,Kampar,Riau,0.346164000000000,101.118903000000000,rs
RS Pertamina Dumai,"Jl. Raya Bukit Datuk,Dumai",A,C,,Riau,1.665742000000000,101.447600000000000,rs
RSUD Petala Bumi,"Jl. Dr. Soetomo No.65, Pekanbaru",A,C,,Riau,0.528850000000000,101.456000000000000,rs
RS Efarina Etaham,"Jl. Lintas Timur No.1, Pangkalan Kerinci - Riau",A,,Riau,Riau,0.262411000000000,101.661564000000000,rs
RS PT Chevron Pasific Indonesia,Jl. Komplek Merapi Duri Camp.PT Chevron Pasific Indonesia,A,,riau,Riau,0.516403000000000,101.447094000000000,rs
Rumkit Bhayangkara Dumai,"Jl. Hang Tuah No.1 Dumai, Bengkalis",A,,Bengkalis,Riau,1.466544000000000,102.250906000000000,rs
RS Eka Hospital Pekanbaru,"Jl. Soekarno- Hatta Km.6,5, Pekanbaru",A,,riau,Riau,0.482261000000000,101.418944000000000,rs
RSUD dr. Rasidin Padang,"Sei.Sapih Kec.Kuranji,Padang",A,C,Padang,Sumatera Barat,0.904914000000000,100.380161000000000,rs
RSUD Teluk Kuantan,Jl. Kesehatan No. 1 Sinambak,A,C,Kuantan Singingi,Riau,-0.531417000000000,101.564578000000000,rs
RSU Indrasari Rengat,Jl. Lintas Timur Sumatera Rengat,A,C,Indragiri Hulu,Riau,-0.394033000000000,102.441736000000000,rs
RSUD Selasih Riau,Kabupaten Pelalawan Propinsi Riau,A,C,Pelalawan,Riau,0.402944000000000,101.845281000000000,rs
RS PTPN V Kbn Sri Rokan,Pos Ujung Batu Tandan Kampar,A,,Kampar,Riau,0.508294000000000,101.441047000000000,rs
RS Tandun,Komplek PTPN V Tandun Kampar,A,,Kampar,Riau,0.627431000000000,100.606869000000000,rs
RS Ibnu Sina Bangkinang,"Jl. Prof.M. Yamin,SH No.16A Bangkinang",A,,Kampar,Riau,0.525631000000000,101.436500000000000,rs
RSUD Kab.Rokan Hulu,"Jl. Syekh Ismail, Pasir Pengarayan",A,C,Rokan Hulu,Riau,0.874447000000000,100.288467000000000,rs
RSU Bengkalis,"Jl. Kelapapati Tengah No.90, Bengkalis",A,D,Bengkalis,Riau,1.466544000000000,102.250906000000000,rs
RSUD Selat Panjang,"Jl. Dorak - Selatpanjang 28753,Bengkalis",A,D,Bengkalis,Riau,1.004664000000000,102.741828000000000,rs
RS Kepolisian Pekanbaru,"Jl. Kartini No.14,Pekanbaru",A,4,Pekanbaru,Riau,0.520058000000000,101.448872000000000,rs
RS PT Caltex Rumbai,Rumbai Pekanbaru,A,,Pekanbaru,Riau,0.629061000000000,101.426492000000000,rs
RS Santa Maria Pekanaru,"Jl. A.Yani 68,Pekanbaru",A,,Pekanbaru,Riau,0.528050000000000,101.443150000000000,rs
RS Jiwa Tampan,"Jl. H.R. Subrantas Km.12,5,Pekanbaru",B,A,Pekanbaru,Riau,0.464850000000000,101.382300000000000,rs
RS Yayasan Abdurrab,"Jl. Jen.Sudirman 410,Pekanbaru",A,,Pekanbaru,Riau,0.504622000000000,101.452328000000000,rs
RS Bhayangkara Pekanbaru,"Simpang Tiga,Pekanbaru",A,4,Pekanbaru,Riau,0.515722000000000,101.449617000000000,rs
RS Nusalima,"Jl. Ronggowarsito No.40,Pekanbaru",A,,Pekanbaru,Riau,0.512708000000000,101.461336000000000,rs
RSIA&quot;Andini&quot;,Jl. Tuanku Tambusai No.55 - Pekanbaru,O,,Pekanbaru,Riau,0.505772000000000,101.437147000000000,rs
RS Lancang Kuning,"Jl. Ronggowarsito Ujung No.5A,Pekanbaru",A,,Pekanbaru,Riau,0.512961000000000,101.464589000000000,rs
RSU Pekanbaru Medical Center,"Jl. Lenbaga Pemasyarakatan No.25, Gobah Pekanbaru",A,,Pekanbaru,Riau,0.514183000000000,101.458500000000000,rs
RSU Dumai,"Jl. Tanjung Jati No.4,Dumai",A,C,Dumai,Riau,1.674500000000000,101.455167000000000,rs
RS Putri Tujuh Dumai,"Jl. Yos Sudarso No.1,Dumai",A,,Dumai,Riau,1.677192000000000,101.470208000000000,rs
RSU Polewali,Jl. Dr Ratulangi 50 Polewali,A,C,Polewali Mandar,Sulawesi Barat,-3.388600000000000,119.220467000000000,rs
RSU Mamuju Utara,"Jl. Bukit Husada - Ako No. 10, Pasangakayu",A,D,Mamuju Utara,Sulawesi Barat,-1.341567000000000,119.381436000000000,rs
RSU lapangan Minake,Minake Kecamatan Tandukkalua - Mamasa,Rumah Sakit Umum,-,Mamasa,Sulawesi Barat,-2.941450000000000,119.377878000000000,rs
RS Banua Mamase,"Mamasa, Kab.Polmas",A,,Mamasa,Sulawesi Barat,-2.941450000000000,119.377878000000000,rs
RSU Majene,"Jl. Poros Majene, Mamuju",A,C,Majene,Sulawesi Barat,-3.029725000000000,118.906278000000000,rs
RSUD Mamuju,Jl. Kurungan Bassi Mamuju,A,D,Mamuju,Sulawesi Barat,-2.699189000000000,118.862114000000000,rs
RS Kusta Makassar,"Jl. P Kemerdekaan Km.14,Makassar",G,B,,Sulawesi Selatan,-5.143661000000000,119.426339000000000,rs
RS Akademis Jaury,Jl. Bulusaraung No. 57 Makassar,A,,,Sulawesi Selatan,-5.131281000000000,119.416000000000000,rs
RSUD Syekh Yusup Gowa,Jl. Dr. Wahidin HS No.48 Sungguminasa,A,B,Gowa,Sulawesi Selatan,-5.330683000000000,119.698425000000000,rs
RSU Palopo,Jl. Samiun No.2 Palopo,A,C,Luwu,Sulawesi Selatan,-3.159203000000000,120.244342000000000,rs
RSU Tenriawaru Bone,Jl. W.Sudirohusodo Watampone,A,B,Bone,Sulawesi Selatan,-4.688475000000000,120.049892000000000,rs
RSUD HA. Sulthan Daeng Radja,Jl. Serikaya No. 17 Bulukumba,A,C,Bulukumba,Sulawesi Selatan,-5.555578000000000,120.185725000000000,rs
RS PT Semen Tonasa,Jl. Beruang No.1 Komp PT Semen Tonasa Pangkep,A,,Pangkajene Kepulauan,Sulawesi Selatan,-4.869214000000000,119.590714000000000,rs
RSU Luramay,Jl. AP Pettarani E19 Makassar,A,C,,Sulawesi Selatan,-5.166344000000000,119.437239000000000,rs
RSU Prof.Dr. A Makkatutu,Jl. Teratai No.20 Bantaeng,A,C,Bantaeng,Sulawesi Selatan,-5.542697000000000,119.951131000000000,rs
RSU Enrekang,Jl. Jend Sudirman Enrekang,A,C,Enrekang,Sulawesi Selatan,-3.519414000000000,119.779428000000000,rs
RS Islam Faisal,"Jl. AP Pettarani E19,Makasar",A,,Makassar,Sulawesi Selatan,-5.163381000000000,119.433000000000000,rs
RSB St Fatimah,Jl. Gn Merapi No. 73 Makassar,O,B,Makassar,Sulawesi Selatan,-5.138953000000000,119.417350000000000,rs
RS Fatima Makale,Jl. Nusantara No.18 Makale Tator,A,C,Tana Toraja,Sulawesi Selatan,-3.416667000000000,119.916667000000000,rs
RSU Sinjai,Jl. Jend Sudirman No. 47 Sinjai,A,c,Sinjai,Sulawesi Selatan,-5.139817000000000,120.242817000000000,rs
