"Name,C,254","Address,C,254","Type,C,254","Class,C,254","District,C,254","Province,C,254","Lat,N,24,15","Long,N,24,15","Hospital,C,254"
RS Medika Stania,"Jl. Jend. Sudirman No.3,Sungailiat",A,,Bangka,Bangka Belitung,-1.875800000000000,106.097000000000000,rs
RSU Bakti Timah,"Jl. Bukit Baru No.1,Pangkal Pinang",A,C,Bangka,Bangka Belitung,-2.230789000000000,106.134569000000000,rs
RSUD Kab.Bangka Tengah,"Jl. By Pass Koba,bangka Tengah",A,D,Bangka Tengah,Bangka Belitung,-2.443900000000000,106.200167000000000,rs
RS Almah,Jl. Raya Air Kenanga Kec. Sungailiat Kab. Bangka,A,A,,Bangka Belitung,-1.875800000000000,106.097000000000000,rs
RSUD Sejiran Setason,Jl. Kadur Dalam Muntok Bangka Barat,A,D,Bangka Barat,Bangka Belitung,-1.837403000000000,105.445775000000000,rs
RSU Sungai Liat,"Jl. Jend Sudirman 195,Sungailiat",A,C,Bangka,Bangka Belitung,-1.883308000000000,106.138689000000000,rs
RS Jiwa Sungai Liat,"Jl. Jend Sudirman,Sungai Liat",B,B,Bangka,Bangka Belitung,-1.904947000000000,106.081264000000000,rs
RSUD Kabupaten Belitung,"Jl. Melati Tajung Pandan,Kab.Belitung",A,C,Belitung,Bangka Belitung,-2.857611000000000,107.955567000000000,rs
RSUD Toboali Kab.Bangka Selatan,Jl. Raya Gadung Toboali,A,D,Bangka Selatan,Bangka Belitung,-2.927056000000000,108.064889000000000,rs
RSUD Kab.Belitung Timur,Jl. Raya Gantung Ds. Padang Belitung Timur,A,D,Belitung Timur,Bangka Belitung,-2.876919000000000,107.912664000000000,rs
RSUD Depati Hamzah,"Jl. Soekarno Hatta,Pk Pinang",A,C,Pangkal Pinang,Bangka Belitung,-2.230803000000000,106.134608000000000,rs
RSUP Persahabatan,"Jl. Raya Persahabatan,Jaktim",A,B,Kota Jakarta Timur,DKI Jakarta,-6.204058000000000,106.884772000000000,rs
RS Pelabuhan Tg.Priok,Jl. Kramat Jaya Tg Priok Jakut,A,,Kota Jakarta Utara,DKI Jakarta,-6.125000000000000,106.918000000000000,rs
RS Manuela,Jl. Mangga Besar VIII/23 Jakbar,A,C,Kota Jakarta Barat,DKI Jakarta,-6.151200000000000,106.809386000000000,rs
RSUP Fatmawati,"Jl. RS Fatmawati Cilandak,Jaksel",A,A,Kota Jakarta Selatan,DKI Jakarta,-6.294844000000000,106.795564000000000,rs
RSUD Budhi Asih,"Jl. Dewi Sartika, Cawang III/ 200,Jakarta Timur",A,B,Kota Jakarta Timur,DKI Jakarta,-6.256169000000000,106.863364000000000,rs
RS Kramat 128,"Jl. Kramat Raya No.128,Jakpus",A,C,Jakarta Pusat,DKI Jakarta,-6.185350000000000,106.844089000000000,rs
RSIA Budi Kemuliaan,Jl. Budi Kemuliaan No.25 Jakarta Pusat,O,,Kota Jakarta Selatan,DKI Jakarta,-6.180025000000000,106.818100000000000,rs
RS Sahid Sahirman,"Jl. Jend.Sudirman No.86, Jaksel",A,,,DKI Jakarta,-6.227203000000000,106.802183000000000,rs
RS Islam Jakarta Utara,Jl. Tipar Cakung No.5 Jakut,A,,Kota Jakarta Utara,DKI Jakarta,-6.139789000000000,106.920956000000000,rs
RS Sumber Waras,Jl. Kiyai Tapa Grogol Jakbar,A,b,Kota Jakarta Barat,DKI Jakarta,-6.166628000000000,106.798008000000000,rs
RS Mitra Keluarga Kelapa Gading,Jl. Bukit Gading Raya Kav.2,A,B,Kota Jakarta Utara,DKI Jakarta,-6.151925000000000,106.897100000000000,rs
Rumkit Tk II M.Ridwan Meuraksa,"Jl. Kramat Raya No.174, Jakarta Pusat",A,2,Kota Jakarta Pusat,DKI Jakarta,-6.191750000000000,106.846608000000000,rs
RS Mata Jkt Eye Centre,Jl. Teuku Cik Ditiro 46 Jakpus,D,B Uta,Kota Jakarta Pusat,DKI Jakarta,-6.198719000000000,106.836861000000000,rs
RS MMC,"Jl. H R. Rasuna Said No.21,Jaksel",A,A,Kota Jakarta Selatan,DKI Jakarta,-6.219878000000000,106.832414000000000,rs
RSIA &quot; Aulia &quot;,"Jl. Jeruk Raya No.15 RT.011 RW 01,Jagakarsa Jaksel",O,,Kota Jakarta Selatan,DKI Jakarta,-6.335000000000000,106.827000000000000,rs
RSU Dr. Cipto Mangunkusumo (RSCM),Jl. Diponegoro 71 Jakarta Pusat,A,A,Jakarta Pusat,DKI Jakarta,-6.196661000000000,106.845153000000000,rs
RSIA Evasari,Jl. Rawamangun No. 47 Jakpus,RSK Ibu & Anak,Khusu,Kota Jakarta Selatan,DKI Jakarta,-6.193733000000000,106.860003000000000,rs
RS Mitra Kemayoran,Jl. Landas Pacu Timur Kemayoran,A,B,Kota Jakarta Utara,DKI Jakarta,-6.152075000000000,106.858639000000000,rs
RS KO Jakarta,"Jl. Lanpangan Tembak no 75 kel cibubur No.76,Jaktim",RSkhusus,B,,DKI Jakarta,-6.346989000000000,106.872000000000000,rs
RSB Yayasan Restu,Jl. Raya Bogor Jakarta Timur,Ibu dan Anak,C,Jakarta Timur,DKI Jakarta,-6.307017000000000,106.865719000000000,rs
RS Omni Medical Center,"Jl. Pulomas Barat VI/20,Jaktim",A,B,Jakarta Timur,DKI Jakarta,-6.179950000000000,106.883614000000000,rs
RS Medika Griya,Jl. Danau Sunter Utara Jakut,A,C,Jakarta Utara,DKI Jakarta,-6.138950000000000,106.865325000000000,rs
RS PGI Tjikini,Jl. Raden Saleh No. 40 Jakpus,A,,Kota Jakarta Selatan,DKI Jakarta,-6.191483000000000,106.841983000000000,rs
RS Jakarta Medical Center (JMC),"Jl. Buncit Raya No.15,Jakarta Selatan",A,,Jakarta Selatan,DKI Jakarta,-6.271394000000000,106.830200000000000,rs
RS THT Bedah Yayasan Yurino,"Jl. Ciranjang No.20-22,Jaksel",K,,Kota Jakarta Selatan,DKI Jakarta,-6.235778000000000,106.810781000000000,rs
RS Islam Jakarta Timur,Jl. Raya Pondok Kopi Jakarta Timur,A,c,Jakarta Timur,DKI Jakarta,-6.220206000000000,106.940094000000000,rs
RSIA Bunda,Jl. Teuku Cik Ditiro No. 28 Jakpus,O,,Jakarta Pusat,DKI Jakarta,-6.195903000000000,106.836536000000000,rs
RS Siloam Graha Medika,Jl. Perjuangan Raya Kav.8 Jakarta Barat,A,B,Jakarta Barat,DKI Jakarta,-6.190781000000000,106.763472000000000,rs
RS Sukmul,Jl. Tawes No.18-20 Jakarta Utara,A,C,Jakarta Utara,DKI Jakarta,-6.112331000000000,106.882000000000000,rs
RS Sint Carolus,Jl. Salemba Raya No.41 Jakarta Pusat,A,B,Jakarta Pusat,DKI Jakarta,-6.184736000000000,106.845131000000000,rs
RS Islam Jakarta Cempaka Putih,Jl. Cempaka Putih Tengah I Jakarta Pusat,A,B,Jakarta Pusat,DKI Jakarta,-6.170311000000000,106.870714000000000,rs
RS Keluarga Afi,Jl. Kalipasir No.9 Jakarta Pusat,A,D,Jakarta Pusat,DKI Jakarta,-6.187217000000000,106.838764000000000,rs
RSIA Bina Sehat Mandiri,"Jl. Duri Raya No.22 Duri Kepa,Jakbar",O,,Jakarta Barat,DKI Jakarta,-6.173650000000000,106.775772000000000,rs
RSUD Koja,"Jl. Deli No.4 Tanjung Priok,Jakut",A,B,Jakarta Utara,DKI Jakarta,-6.108861000000000,106.900000000000000,rs
RS Pantai Indah Kapuk,Jl. Pantai Indah Utara 3 Jakut,A,,Jakarta Utara,DKI Jakarta,-6.111944000000000,106.753183000000000,rs
RS Jiwa Dharmawangsa,"Jl. Dharmawangsa Raya 13,Jaksel",B,,Jakarta Selatan,DKI Jakarta,-6.252297000000000,106.803961000000000,rs
RSB Budhi Jaya,"Jl. Dr. Sahardjo 120,Jaksel",C,,Jakarta Selatan,DKI Jakarta,-6.219008000000000,106.844986000000000,rs
RS FK UKI,"Jl. May.Jen Soetoyo Cawang,Jakarta Timur",A,,Jakarta Timur,DKI Jakarta,-6.250919000000000,106.872000000000000,rs
RS Mitra Internasional,"Jl. Jatinegara Timur No.85A-87,Jaktim",A,B,Jakarta Timur,DKI Jakarta,-6.221397000000000,106.868189000000000,rs
RS Harapan Bunda,Jl. Raya Bogor Km.22 No.44 Jaktim,A,C,Jakarta Timur,DKI Jakarta,-6.303031000000000,106.867431000000000,rs
RSJ Dr Soeharto Heerjan Jakarta,Jl. Prof.Dr.Latumeten No. 1 Jakbar,B,A,Jakarta Barat,DKI Jakarta,-6.162481000000000,106.788000000000000,rs
RS Jantung & Pembuluh Darah H K,Jl. S. Parman Kav 87 Jakbar,L,A,Jakarta Barat,DKI Jakarta,-6.171967000000000,106.790089000000000,rs
RS Ibu dan Anak Sayyidah,"Jl. Taman malaka Selatan No.6 Pondok Kelapa, Jaktim",O,,Jakarta,DKI Jakarta,-6.232531000000000,106.932258000000000,rs
RSUD Cengkareng,"Dra. Khafifah Any,Apt,MARS",A,B,PemPro DKI Jakarta,DKI Jakarta,-6.142750000000000,106.735000000000000,rs
RS Pusat Pertamina,"Jl. Kyai Maja,Jakarta Selatan",A,,Jakarta Selatan,DKI Jakarta,-6.242836000000000,106.800478000000000,rs
RS AL Cilandak,"Jl. Raya Cilandak,Jaksel",A,3,Jakarta Selatan,DKI Jakarta,-6.309597000000000,106.814869000000000,rs
RS Jakarta,"Jl. Jend.Sudirman Kav.49,Jaksel",A,,Jakarta Selatan,DKI Jakarta,-6.227203000000000,106.802183000000000,rs
RSB Panti Nugeraha,"Jl. Senayan 26 Kby.Baru,Jaksel",C,,Jakarta Selatan,DKI Jakarta,-6.235617000000000,106.816222000000000,rs
RS Kebayoran,"Jl. Birah III/4 Keb Baru,Jaksel",A,,Jakarta Selatan,DKI Jakarta,-6.233158000000000,106.822033000000000,rs
RSB Asih,"Jl. Panglima Polim I/34,Jakarta Selatan",C,,Jakarta Selatan,DKI Jakarta,-6.250139000000000,106.797522000000000,rs
RS Mata Aini,"Jl. HR Rasuna Said,Jaksel",D,,Jakarta Selatan,DKI Jakarta,-6.213200000000000,106.821719000000000,rs
RS Setia Mitra,"Jl. Fatmawati No. 80-82,Jaksel",A,,Jakarta Selatan,DKI Jakarta,-6.269361000000000,106.806056000000000,rs
RS Tebet,"Jl. Let.Jend.Haryono. MT No.8,Jaksel",A,,Jakarta Selatan,DKI Jakarta,-6.238467000000000,106.851469000000000,rs
RS Pondok Indah,"Jl. Metro Duta Pd Indah,Jaksel",A,,Jakarta Selatan,DKI Jakarta,-6.280486000000000,106.780350000000000,rs
RSU Prikasih,"Jl. RS Fatmawati Raya 74,Jaksel",A,,Jakarta Selatan,DKI Jakarta,-6.313358000000000,106.794989000000000,rs
RS Harapan Kartini,"Jl. Ampera Raya No.1,Jaksel",A,,Jakarta Selatan,DKI Jakarta,-6.286136000000000,106.815633000000000,rs
RSU Gandaria,"Jl. Gandaria Tengah 11 Kby Baru,Jaksel",A,,Jakarta Selatan,DKI Jakarta,-6.246517000000000,106.792994000000000,rs
RS Agung,"Jl. Sultan Agung No.67,Jaksel",A,,Jakarta Selatan,DKI Jakarta,-6.209253000000000,106.844683000000000,rs
RS Siaga Raya,"Jl. Siaga Raya Kav.4-8,Jaksel",A,,Jakarta Selatan,DKI Jakarta,-6.272933000000000,106.838208000000000,rs
RS Pasar Minggu,"Jl. Raya Ragunan P 7,Jaksel",A,,Jakarta Selatan,DKI Jakarta,-6.286483000000000,106.832919000000000,rs
RS Medistra,"Jl. Gatot Subroto Kav 59,Jaksel",A,,Jakarta Selatan,DKI Jakarta,-6.240011000000000,106.833792000000000,rs
RS Indah Medika,"Jl. Tebet Raya No. 4-6,Jaksel",A,,Jakarta Selatan,DKI Jakarta,-6.229464000000000,106.848239000000000,rs
RSU Tria Dipa,"Jl. Raya Pasar Minggu No.3A,Jaksel",A,,Jakarta Selatan,DKI Jakarta,-6.250483000000000,106.842650000000000,rs
RSGM Univ.Prof.Moestopo,"Jl. Bintaro Permai Raya,Jaksel",T,,Jakarta Selatan,DKI Jakarta,-6.255444000000000,106.766953000000000,rs
RSIA Zahirah,"Jl. Sirsak No.21 RT/RW 009/001,Jagakarsa,Jaksel",O,,Jakarta Selatan,DKI Jakarta,-6.335719000000000,106.823697000000000,rs
RSB Kartini,"Jl. Ciledug Raya No.94-96 Cipulir, Keabayoran Lama",C,,Jakarta Selatan,DKI Jakarta,-6.238389000000000,106.769967000000000,rs
RSIA Brawijaya Women and Children Hospital,"Jl..Taman Brawijaya No.1,Cepete Utara,Jaksel",O,,Jakarta Selatan,DKI Jakarta,-6.257381000000000,106.807539000000000,rs
RSB Durentiga,Jl. Duren Tiga Raya No.5 Pancoran Jaksel,C,,Jakarta Selatan,DKI Jakarta,-6.253381000000000,106.841000000000000,rs
RSIA Muhammadiyah Taman Puring,"Jl. Gandaria I/20 Kebayoran Baru, Jaksel",O,,Jakarta Selatan,DKI Jakarta,-6.241600000000000,106.787000000000000,rs
RS LPK Cipinang,"Jl. Bekasi Timur 170,Jaktim",A,,Jakarta Timur,DKI Jakarta,-6.209758000000000,106.892806000000000,rs
RS Pusdikkes,"Jl. Raya Bogor,Jakarta Timur",A,4,Jakarta Timur,DKI Jakarta,-6.276139000000000,106.869014000000000,rs
RS Halim Perdana Kusuma,"Jl. Merpati No. 2 Halim Perdana Kusuma, Jakarta",A,2,Jakarta Timur,DKI Jakarta,-6.262081000000000,106.894000000000000,rs
RS Kepolisian Pusat,"Kramat Jati,Jakarta Timur",A,2,Jakarta Timur,DKI Jakarta,-6.275767000000000,106.876178000000000,rs
Rumkit Tk IV Cijantung,"Jl. Mahoni Pasar Rebo,Jaktim",A,4,Jakarta Timur,DKI Jakarta,-6.307281000000000,106.859000000000000,rs
RSU Pasar Rebo,"Jl. TB Simatupang No.30,Jaktim",A,B,Jakarta Timur,DKI Jakarta,-6.318383000000000,106.867397000000000,rs
RSIA Hermina,"Jl. Jatinegara Barat 126,Jaktim",O,B,Jakarta Timur,DKI Jakarta,-6.220242000000000,106.864642000000000,rs
RSK Bedah Rawamangun,"Jl. Balai Pustaka Raya,Jaktim",K,,Jakarta Timur,DKI Jakarta,-6.196614000000000,106.884547000000000,rs
RSU Kartika Pulo Mas,Jl. Pulo Mas Barat IV Jaktim,A,,Jakarta Timur,DKI Jakarta,-6.174064000000000,106.885097000000000,rs
RS Harum,"Jl. Tarum Barat, Kalimalang",A,,Jakarta Timur,DKI Jakarta,-6.247692000000000,106.909267000000000,rs
RS Harapan Jayakarta,Jl. Bekasi Timur No. 6 Jaktim,A,,Jakarta Timur,DKI Jakarta,-6.194922000000000,106.906128000000000,rs
RS Yadika,Jl. P.Revolusi No.47 Pondok Bambu Jaktim,A,C,Jakarta Timur,DKI Jakarta,-6.255228000000000,106.777925000000000,rs
RS Dharma Nugraha,Jl. Balai Pustaka Baru 9 Jaktim,A,,Jakarta Timur,DKI Jakarta,-6.199342000000000,106.854600000000000,rs
RS Mediros,"Jl. P.Kemerdekaan 149,Jaktim",A,,Jakarta Timur,DKI Jakarta,-6.179628000000000,106.903822000000000,rs
RSU Haji Jakarta,Jl. Raya Pondok Gede Jaktim,A,C,Jakarta Timur,DKI Jakarta,-6.290036000000000,106.889300000000000,rs
RS Jiwa Islam Klender,Jl. Bunga Rampai X P.Klender Jaktim,B,,Jakarta Timur,DKI Jakarta,-6.221719000000000,106.934689000000000,rs
RS Jiwa Duren Sawit,Jl. Duren Sawit Baru Jakarta Timur,B,A,Jakarta Timur,DKI Jakarta,-6.232133000000000,106.908869000000000,rs
RS PAD Gatot Soebroto,Jl. Dr A Rahman Saleh No. 24 Jakarta Pusat,A,1,Jakarta Pusat,DKI Jakarta,-6.176172000000000,106.838714000000000,rs
RS AL Dr Mintoharjo,Jl. Bendungan Hilir 17 Jakpus,A,2,Jakarta Pusat,DKI Jakarta,-6.210950000000000,106.812000000000000,rs
RS Husada,Jl. Raya Mangga Besar No.137/139 Jakpus,A,,Jakarta Pusat,DKI Jakarta,-6.148722000000000,106.834633000000000,rs
RSB Yy Pemelihara Kesehatan,Jl. Gereja Theresia No.22 Menteng Jakpus,C,,Jakarta Pusat,DKI Jakarta,-6.189594000000000,106.826647000000000,rs
RS Jiwa Dharma Jaya,Jl. Raya Mangga Besar Jakarta Pusat,B,,Jakarta Pusat,DKI Jakarta,-6.148214000000000,106.830058000000000,rs
RSK Bedah Kramat Lima,Jl. Kramat V No. 6 Jakpus,K,,Jakarta Pusat,DKI Jakarta,-6.187958000000000,106.843217000000000,rs
RSB Angkasa,Jl. Budikemuliaan 12 Jakpus,C,,Jakarta Pusat,DKI Jakarta,-6.180161000000000,106.819658000000000,rs
RS Pertamina Jaya,Jl. A. Yani No. 2 By Pass Jakarta Pusat,A,,Jakarta Pusat,DKI Jakarta,-6.173286000000000,106.876092000000000,rs
RS Jiwa Dharma Sakti,Jl. Kaji 40 Jakarta Pusat,B,,Jakarta Pusat,DKI Jakarta,-6.168908000000000,106.815972000000000,rs
RS Moh Husni Thamrin,Jl. Salemba Tengah 24-28 Jakpus,A,,Jakarta Pusat,DKI Jakarta,-6.193550000000000,106.852000000000000,rs
RSK THT Bedah P.Raharja,Jl. Sawo No. 58-60 Jakpus,M,,Jakarta Pusat,DKI Jakarta,-6.195444000000000,106.870661000000000,rs
RSU Tarakan,Jl. Kyai Caringin Jakarta Pusat,A,B,Jakarta Pusat,DKI Jakarta,-6.172839000000000,106.806458000000000,rs
RSK THT Bedah Proklamasi,Jl. Proklamasi 43 Jakarta Pusat,K,,Jakarta Pusat,DKI Jakarta,-6.201897000000000,106.848233000000000,rs
RS Abdi Waluyo,Jl. Hos Cokroaminoto 31-33 Jakarta Pusat,A,,Jakarta Pusat,DKI Jakarta,-6.189686000000000,106.829031000000000,rs
RSK THT Prof Nizar,Jl. Kesehatan No. 9 Jakpus,M,,Jakarta Pusat,DKI Jakarta,-6.171808000000000,106.814911000000000,rs
RSK Bedah Bina Estetika,Jl. Teuku Cik Ditiro 41 Jakarta Pusat,K,,Jakarta Pusat,DKI Jakarta,-6.199492000000000,106.837597000000000,rs
RS Jiwa Mita Menteng Abadi,Jl. Kalipasir No.9 Jakarta Pusat,B,D,Jakarta Pusat,DKI Jakarta,-6.187217000000000,106.838764000000000,rs
RSGM FKG Univ.Indonesia,Jl. Salemba Raya No. 4 Jakpus,T,A,Jakarta Pusat,DKI Jakarta,-6.193161000000000,106.852625000000000,rs
RSIA Berkat Ibu,"Jl. Sumur Batu Raya Blok A3 No.13 Kemayoran,Jakpus",O,,Jakarta Pusat,DKI Jakarta,-6.162081000000000,106.865897000000000,rs
RSIA Tambak,"Jl. Tambak No.18 Manggarai, Jakpus",O,,Jakarta Pusat,DKI Jakarta,-6.205608000000000,106.849244000000000,rs
RS Pelni Petamburan,Jl. K. S. Tubun 92-94 Jakbar,A,,Jakarta Barat,DKI Jakarta,-6.193433000000000,106.805325000000000,rs
RS Trisna Pangastuti,Jl. KS Tubun No.79 Slipi Jakbar,A,,Jakarta Barat,DKI Jakarta,-6.199211000000000,106.801000000000000,rs
RS Kanker Dharmais,Jl. S Parman Kav.84-86 Slipi Jakarta Barat,E,,Jakarta Barat,DKI Jakarta,-6.186967000000000,106.797753000000000,rs
RS Anak dan Bunda H K,Jl. S Parman Kav 87 Jakbar,O,,Jakarta Barat,DKI Jakarta,-6.184061000000000,106.796283000000000,rs
RSK Benda Chandera,Jl. Raya Mangga Besar 40 Jakbar,K,,Jakarta Barat,DKI Jakarta,-6.148828000000000,106.825525000000000,rs
RSU Al-Kamal,Jl. Raya Al Kamal Kebon Jeruk Jakbar,A,,Jakarta Barat,DKI Jakarta,-6.187225000000000,106.762019000000000,rs
RS Patria IKKT,Jl. Cendrawasih 1 Slipi Jakbar,A,,Jakarta Barat,DKI Jakarta,-6.196956000000000,106.792669000000000,rs
RS Medika Permata Hijau,Jl. Kebayoran Lama No.64 Jakarta Barat,A,,Jakarta Barat,DKI Jakarta,-6.218350000000000,106.778000000000000,rs
RSIA Hermina Daan Mogot,Jl. Kintamani Raya No. 2 Jakbar,O,,Jakarta Barat,DKI Jakarta,-6.152761000000000,106.712000000000000,rs
RSGM Yayasan Trisakti,Jl. Kyai Tapa Grogol Jakbar,T,,Jakarta Barat,DKI Jakarta,-6.166628000000000,106.792894000000000,rs
RSK Bedah Cinta Kasih Tzu Chi,Jl. Kramat Raya Komplek Rusun BCI Jakbar,K,,Jakarta Barat,DKI Jakarta,-6.161094000000000,106.705800000000000,rs
RS Puri Mandiri Kedoya,"Jl. Raya Kedoya No.2,Kelurahan Kedoya Jakbar",A,,Jakarta Barat,DKI Jakarta,-6.188222000000000,106.762200000000000,rs
RS Royal Taruma,"Jl. Daan Mogot No.34,Jakarta Barat",A,,Jakarta Barat,DKI Jakarta,-6.166364000000000,106.785022000000000,rs
RS Puri Indah,"Jl. Puri Indah Raya,Blok S-2,Kel.Kembangan Selatan,Jakbar",A,,Jakarta Barat,DKI Jakarta,-6.185856000000000,106.740725000000000,rs
RS Akademik Atma Jaya,Jl. Pluit Raya Jakarta Utara,A,,Jakarta Utara,DKI Jakarta,-6.126683000000000,106.793053000000000,rs
RSTP Ancol,Jl. LE. Martadinata Jakut,F,,Jakarta Utara,DKI Jakarta,-6.133947000000000,106.830161000000000,rs
RSPI Prof.Dr. Sulianti S.,Jl. Sunter Permai Raya Jakarta Utara,H,,Jakarta Utara,DKI Jakarta,-6.130389000000000,106.862003000000000,rs
RSIA Hermina Podomoro,Jl. Danau Agung 2 Sunter Jakarta Utara,C,,Jakarta Utara,DKI Jakarta,-6.145608000000000,106.861492000000000,rs
RS Satya Negara,Jl. Agung Utara Raya No. 1 Jakut,A,,Jakarta Utara,DKI Jakarta,-6.137586000000000,106.858592000000000,rs
RS Pluit,Jl. Raya Pluit Selatan 2 Jakut,A,,Jakarta Utara,DKI Jakarta,-6.125578000000000,106.798336000000000,rs
RSIA Family,Jl. Pluit Mas I Blok A Jakut,O,C,Jakarta Utara,DKI Jakarta,-6.133792000000000,106.790572000000000,rs
RSIA Puri Medika,Jl. Sungai Bambu 5A Tanjung Priok,O,,Jakarta Utara,DKI Jakarta,-6.129944000000000,106.885417000000000,rs
RS Port Medical Center,"Jl. Enggano No.10 Tanjung Priok, Jakarta Utara",A,,Jakarta Utara,DKI Jakarta,-6.110758000000000,106.887861000000000,rs
RS Gading Pluit,"Jl. Boulevard Timur Raya Pegangsaan Dua,Kelapa Gading",A,,Jakarta Utara,DKI Jakarta,-6.166378000000000,106.916922000000000,rs
RS Proklamasi,"Jl. Proklamasi KM.2 Rengasdengklok,Karawang",A,,Karawang,Jawa Barat,-6.201892000000000,106.847014000000000,rs
RS Sumber Waras,"Jl. Urip Sumoharjo No.5 Ciwaringin,Kab.Cirebon",A,,Kota Cirebon,Jawa Barat,-6.166628000000000,106.798008000000000,rs
RS Mulyasari,"Jl. Raya Plumpung Semper No.19 RT.006/RW.015, Jakarta Utara",A,0,JAKARTA UTARA,DKI Jakarta,-6.129400000000000,106.917319000000000,rs
RS Kusta Balun,Jl. Maruti 10 Denpasar,G,,Kota Denpasar,Bali,-8.644592000000000,115.211061000000000,rs
RSU Prima Cipta,Jl. P Serangan 9X Denpasar Bali,A,,,Bali,-8.721714000000000,115.223822000000000,rs
RSU Amlapura,Jl. Ngurah Rai - Amlapura,A,C,Karang Asem,Bali,-8.457250000000000,115.606500000000000,rs
RS Karya Dharma Husada,Jl. Yudistra No. 7 Singaraja,A,C,Buleleng,Bali,-8.146683000000000,115.048325000000000,rs
RSUD Wangaya,Jl. Kartini No.133 Denpasar,A,B,Kota Denpasar,Bali,-8.648956000000000,115.213403000000000,rs
RSUD Kab. Buleleng,Jl. Ngurah Rai 30 Singaraja,A,B,Buleleng,Bali,-8.119911000000000,115.092367000000000,rs
RSU Surya Husadha,"Jl. Pulau Serangan No.7, Denpasar",A,C,Denpasar,Bali,-8.727600000000000,115.228956000000000,rs
RSU Dr GelGel,Jl. Mawar No. 76 Tabanan,A,D,Tabanan,Bali,-8.546844000000000,115.124347000000000,rs
RSU Negara,Jl. Wijaya Kusuma 17 Negara,A,C,Jembrana,Bali,-8.354136000000000,114.621797000000000,rs
RSUD Sanjiwani Gianyar,Jl. Ciung Wenara No.2 Gianyar,A,B,Gianyar,Bali,-8.537967000000000,115.322736000000000,rs
RSU Bhakti Rahayu,"Jl. Batukaru No.2 Br.Tuakilang, Tabanan",A,,Bali,Bali,-8.545039000000000,115.119961000000000,rs
RSUD Badung,"Jl. Raya Kapal Mengwi, Badung",A,D,Badung,Bali,-8.572281000000000,115.180028000000000,rs
RS Parama Sidhi,"Jl. Ahmad Yani No.177 A Baktiseraga, Singaraja",A,,Bali,Bali,-8.122689000000000,115.071000000000000,rs
RSU Tabanan,Jl. Pahlawan No. 14 Tabanan,A,B,Tabanan,Bali,-8.539283000000000,115.131883000000000,rs
RSK Bedah dan Penyakit Dalam BIMC,"Jl. By Pass Ngurah Rai No.100 X, Kuta - Badung",J,,Badung,Bali,-8.677750000000000,115.205522000000000,rs
RSU. Dharma Yadnya,"Jl. WR.Supratman 256,Denpasar",A,D,Denpasar,Bali,-8.642069000000000,115.251133000000000,rs
RS Ibu dan Anak Puri Bunda,"Jl. Gatot Subroto VI /19, Denpasar",O,,Denpasar,Bali,-8.673550000000000,115.232172000000000,rs
RSU Premagana,"Jl. Hyang Sangsi No.2 Komp.Perumahan Chandra Ayu Br. Tubuh,Batubulan,Sukawati - More ...",A,-,-,Bali,-8.608128000000000,115.293792000000000,rs
RSU Dharma Sentana,Jl. Ngurah Rai 151 Negara,A,,Jembrana,Bali,-8.314989000000000,114.602492000000000,rs
RSB Kertayasa,Jl. Ngurah Rai 143 Negara,C,,Jembrana,Bali,-8.323344000000000,114.666794000000000,rs
RS Dharma Kerti Tabanan,Jl. Teratai 16 Tabanan,A,,Tabanan,Bali,-8.540969000000000,115.118086000000000,rs
RSU Klungkung,Jl. Flamboyan No. 40 Klungkung,A,C,Klungkung,Bali,-8.538569000000000,115.395097000000000,rs
RSU Bangli,Jl. Kusuma Yudha No. 27 Bangli,A,C,Bangli,Bali,-8.454267000000000,115.352647000000000,rs
RS Jiwa Bangli,Jl. Kusuma Yudha No. 29 Bangli,B,A,Bangli,Bali,-8.454211000000000,115.352000000000000,rs
Rumkit Tk.IV Singaraja,Jl. Ngurah Rai No. 70 Singaraja,A,4,Buleleng,Bali,-8.125458000000000,115.090600000000000,rs
RS Kertha Usadha,Jl. Cendrawasih No.5 Singaraja,A,,Buleleng,Bali,-8.674786000000000,115.152800000000000,rs
RS Kertha Usada II,Jl. Cendrawasih No. 5 Singaraja,A,,Buleleng,Bali,-8.674786000000000,115.152800000000000,rs
RSUP Sanglah Denpasar,Jl. Diponegoro Denpasar,A,A,Denpasar,Bali,-8.676161000000000,115.213103000000000,rs
Rumkit Tk.III Udayana Denpasar,Jl. P.B Sudirman No.1 Denpasar,A,3,Denpasar,Bali,-8.663467000000000,115.218678000000000,rs
RSU Dharma Usadha,Jl. P.B. Sudirman 50 Denpasar,A,,Denpasar,Bali,-8.670633000000000,115.217742000000000,rs
RSU Manuaba,Jl. Cokroaminoto 28 Denpasar,A,,Denpasar,Bali,-8.644183000000000,115.209322000000000,rs
RS Jiwa Bina Atma,Jl. Cokroaminoto 256 Km.5 Denpasar,B,,Denpasar,Bali,-8.630000000000000,115.201189000000000,rs
RSK Bedah Graha Usadha,Jl. Cokroaminoto No.28 Denpasar,K,,Denpasar,Bali,-8.643361000000000,115.210000000000000,rs
RSU Kasih Ibu,"Jl. Teuku Umar 120,Denpasar",A,,Denpasar,Bali,-8.677750000000000,115.205522000000000,rs
RSU Puri Raharja,Jl. WR Supratman 14-19 Denpasar,A,,Denpasar,Bali,-8.649367000000000,115.226475000000000,rs
RSU Sari Dharma,Jl. Pulau Seram No.8 Denpasar,A,,Denpasar,Bali,-8.670953000000000,115.213950000000000,rs
RSU Bhakti Rahayu,Jl. Gatot Subroto II /11 Denpasar,A,,Denpasar,Bali,-8.637339000000000,115.221000000000000,rs
RSB Harapan Bunda,Jl. Tukad Unda No. 1 Denpasar,C,,Denpasar,Bali,-8.673550000000000,115.232172000000000,rs
RS Graha Asih,Jl. IG Ngurah Rai 33 Kuta Bali,A,,Denpasar,Bali,-8.731958000000000,115.179003000000000,rs
RSGM FKG Un Mahasaraswati,Jl. Kamboja 11A Denpasar,T,,Denpasar,Bali,-8.653139000000000,115.224639000000000,rs
RS Balimed,"Jl.Mahendradatta No.57,Denpasar Bali",A,,Denpasar,Bali,-8.656908000000000,115.191656000000000,rs
RSU Shanti Graha,"Desa Sulanyah, Kecamatan Seririt, Singaraja",A,D,,Bali,-8.191378000000000,114.961117000000000,rs
RS Paru Dr. H.A. Rotinsulu Bandung,Jl. Bukit Jarian No. 40 Bandung,F,A,Kota Bandung,Jawa Barat,-6.877661000000000,107.606561000000000,rs
RSB Astanaanyar,Jl. Astanaanyar 224 Bandung,C,,Kota Bandung,Jawa Barat,-6.925961000000000,107.611700000000000,rs
RSIA Sukajadi,Jl. Sukajadi No. 149 Bandung,O,,Kota Bandung,Jawa Barat,-6.886711000000000,107.596161000000000,rs
RS Jiwa Hurip Waluya,Jl. Karang Tineung No.1A Bandung,B,C,Kota Bandung,Jawa Barat,-6.883944000000000,107.594247000000000,rs
RS Al-Islam Bandung,Jl. Soekarno. Hatta 644 Bandung,A,,Kota Bandung,Jawa Barat,-6.939222000000000,107.669000000000000,rs
RSK Bedah Halmahera Siaga,Jl. Halmahera No. 10 Bandung,K,,Kota Bandung,Jawa Barat,-6.907233000000000,107.616025000000000,rs
RS PKU Muhammadiyah,"Jl. Raya Kedu Km.2,Temanggung",A,C,Temanggung,Jawa Tengah,-7.291367000000000,110.173372000000000,rs
RS Islam Kendal,"Jl. Ar.Rahmah No.17 Weleri,Kendal",A,,Kendal,Jawa Tengah,-6.923569000000000,110.067458000000000,rs
RSUD Kab. Batang,"Jl. Dr Sutomo No. 42,Batang",A,C,Batang,Jawa Tengah,-6.914681000000000,109.719422000000000,rs
RSU Bhakti Waluyo,"Ds Sukorejo,Warungasem,Batang",A,,Batang,Jawa Tengah,-6.903186000000000,109.695903000000000,rs
RSUD Kajen Kab.Pekalongan,Jl. Raya Karangsari Karanganyar,A,C,Pekalongan,Jawa Tengah,-6.988967000000000,110.446153000000000,rs
RSUD Bendan Kota Pekalongan,"Jl. Sriwijaya No.2,Pekalongan",A,D,Pekalongan,Jawa Tengah,-6.894569000000000,109.660106000000000,rs
RS Islam Moga,"Jl. Raya Moga Pulosari,Pemalang",A,,Pemalang,Jawa Tengah,-6.901419000000000,109.412533000000000,rs
RS Islam Al-Ikhlas,"Jl. Kol.Soegiono No.13,Pemalang",A,,Pemalang,Jawa Tengah,-6.904083000000000,109.411469000000000,rs
RSTP Kalibakung,"Jl. Dr Sutomo 63,Slawi",F,,Tegal,Jawa Tengah,-6.992739000000000,109.139344000000000,rs
RSB Harapan Ibu,"Jl. Raya Procot,Slawi",C,,Tegal,Jawa Tengah,-6.871061000000000,109.129142000000000,rs
RSB Utama Aisyiyah &quot;Siti Hajar&quot;,Jl. Kartini No.41 Kab. Tegal,C,,Tegal,Jawa Tengah,-6.870214000000000,109.140047000000000,rs
RSU Brebes,"Jl. Jend.Sudirman No.181,Brebes",A,C,Brebes,Jawa Tengah,-6.874686000000000,109.046378000000000,rs
RS SELARAS,Jl. Raya Lapan Rumpin Suradita,A,D,Tangerang,Banten,-6.228892000000000,106.519767000000000,rs
RSIA Tiara,Jl. Raya serang KM 14.5 No.1,C,-,Tangerang,Banten,-6.136239000000000,106.140125000000000,rs
RS Islam Sari Asih Ar-rahmah,Jl. K.S Tubun No.44 Koang Jaya,A,D,Kota Tangerang,Banten,-6.163733000000000,106.629178000000000,rs
RS Mitra Husada,Tangerang Banten,A,,Tangerang,Banten,-6.080789000000000,106.650111000000000,rs
RS Mayapada,Jl. Honoris Raya Kav.6 Tangerang,A,C+,Kota Tangerang,Banten,-6.203092000000000,106.641797000000000,rs
RS Q a d r,Komp Islamic Village Curug Tangerang,A,C,Tangerang,Banten,-6.227294000000000,106.616469000000000,rs
RSIA An-Nisa Tangerang,Jl. Gatot Subroto 96 Tangerang,O,C,Kota Tangerang,Banten,-6.187978000000000,106.604344000000000,rs
